title,originallink,link,description,pubDate
與 <b>윤석열</b> 손익계산서 보니… 손해만 본 건 아니다?,http://news.kmib.co.kr/article/view.asp?arcid=0924181945&code=11121100&cp=nv,https://news.naver.com/main/read.nhn?mode=LSD&mid=sec&sid1=100&oid=005&aid=0001419964,"그러나 조 전 장관 <b>부인</b>인 정경심 동양대 교수가 지난해 12월 입시비리 및 사모펀드 관련 혐의로 징역 4년, 벌금 5억원을 선고받고 법정구속되면서 기류가 변했다. <b>자녀</b> 입시비리 의혹 등 11개 혐의로 기소된 조 전 장관에게... ","Sat, 13 Mar 2021 04:04:00 +0900"
[이주의 재판일정] '징계 집행정지' <b>윤석열</b> 심문기일 外,http://www.fnnews.com/news/202012191421299350,https://news.naver.com/main/read.nhn?mode=LSD&mid=sec&sid1=102&oid=014&aid=0004550127,이번 주(12월 21일~25일) 법원에서는 정직 2개월의 징계처분을 받은 <b>윤석열</b> 검찰총장의 징계 집행정지 신청 심문기일이 열린다. <b>자녀</b> 입시비리와 사모펀드 의혹 등으로 재판에 넘겨진 조국 전 법무부 장관의 <b>부인</b> 정경심... ,"Sun, 20 Dec 2020 09:00:00 +0900"
[오태훈의 시사본부] 조해진 “<b>윤석열</b>은 투자처 찾지 못한 시장에 나온 블루칩...,http://news.kbs.co.kr/news/view.do?ncd=5134680&amp;ref=A,https://news.naver.com/main/read.nhn?mode=LSD&mid=sec&sid1=100&oid=056&aid=0011003143,뭐 그만두는 건 자의로 그만둔 거지만 <b>윤석열</b> 전 총장이 정치를 하는 게 맞겠냐? 특히 대권에 도전하는 게 맞겠냐? 이 부분에 대해서는 그동안 검찰총장을 해 오면서 했던 여러 가지 행태들 그리고 그 주변의 <b>부인</b>과 장모가... ,"Tue, 09 Mar 2021 16:28:00 +0900"
"조국 &quot;韓 언론, 광견·애완견처럼 취재…<b>윤석열</b>·나경원엔 얌전&quot;",https://www.hankyung.com/politics/article/2020111512747,https://news.naver.com/main/read.nhn?mode=LSD&mid=sec&sid1=100&oid=015&aid=0004449948,"조국 전 법무부장관은 한국 언론이 <b>윤석열</b> 검찰총장의 장모와 <b>부인</b>, 나경원 전 자유한국당 원내대표와... 자신과 가족이 지난해 <b>자녀</b> 입시 비리와 사모펀드 불법 투자 의혹 등의 혐의로 검찰 조사를 받을 당시 언론의 보도... ","Sun, 15 Nov 2020 17:25:00 +0900"
[나이트포커스] <b>윤석열</b> 직무 복귀...법원 판단 배경은?,https://www.ytn.co.kr/_ln/0101_202012242224547386,https://news.naver.com/main/read.nhn?mode=LSD&mid=sec&sid1=100&oid=052&aid=0001530328,"그러면 결국은 지금 <b>윤석열</b> 총장의 손을 완벽하게 들어준 거다, 이런 판결이었다라고 평가할 수밖에 없는 거죠. 그렇군요. 조국 전 장관의 <b>부인</b> 정경심 교수에 대한 법원의 판결이 어제 나왔었죠. 징역 4년이라는 중형을... ","Thu, 24 Dec 2020 22:24:00 +0900"
"<b>윤석열</b> 아내, 나경원 의혹 압색 기각…&quot;정치적 고려 없어&quot;",https://www.nocutnews.co.kr/news/5445447,https://news.naver.com/main/read.nhn?mode=LSD&mid=sec&sid1=102&oid=079&aid=0003430412,서울중앙지검이 <b>윤석열</b> 검찰총장의 아내 관련 사건과 나경원 전 미래통합당(국민의힘 전신)을 둘러싼 각종... 이 사건과는 별개로 나경원 전 의원 <b>자녀</b>의 입시‧논문 특혜 의혹을 수사 중인 중앙지검 형사7부(이병석... ,"Wed, 11 Nov 2020 15:36:00 +0900"
"與, 옵티머스 수사팀 증원지시 <b>윤석열</b>에 &quot;장모도 엄정 수사&quot;",http://yna.kr/AKR20201013085200001?did=1195m,https://news.naver.com/main/read.nhn?mode=LSD&mid=sec&sid1=100&oid=001&aid=0011939716,"더불어민주당은 옵티머스 펀드 사기 의혹 사건 수사팀의 증원을 지시한 <b>윤석열</b> 검찰총장에 대해 13일 &quot;장모의... 의원 <b>자녀</b>, 박덕흠 의원 등에도 동일한 원칙이 적용된 수사 지시를 내려줄 것을 촉구한다&quot;고 했다. 신... ","Tue, 13 Oct 2020 11:57:00 +0900"
"<b>윤석열 부인</b> 고발 2건, 반부패수사2부에 배당…秋 vs 尹 충돌 예상",https://www.donga.com/news/article/all/20201105/103820168/1,https://news.naver.com/main/read.nhn?mode=LSD&mid=sec&sid1=102&oid=020&aid=0003318827,추미애 법무부장관이 수사지휘권을 발동한 <b>윤석열</b> 검찰총장의 <b>부인</b> 김건희 씨 고발 사건 2건이 모두 서울중앙지검의 반부패수사2부에 배당됐다. 공교롭게 반부패수사2부는 지난해 조국 전 법무부장관의 <b>자녀</b> 입시비리와... ,"Thu, 05 Nov 2020 17:18:00 +0900"
"기소된 최강욱, <b>윤석열</b> 향해 &quot;개가 짖어도 기차는 달려&quot;(종합)",http://yna.kr/AKR20201016026251001?did=1195m,https://news.naver.com/main/read.nhn?mode=LSD&mid=sec&sid1=100&oid=001&aid=0011949583,"선거기간 <b>자녀</b> 특혜 의혹에 '그런 사실 없다'고 잡아떼던 나경원 전 의원은 왜 기소하지 않았는가, <b>윤석열</b>은... 기소를 <b>부인</b>하면 허위사실 유포로 다시 기소하겠다는 것은 '짐이 틀리는 법은 없다'는 임금이나 할 소리&quot;라고... ","Fri, 16 Oct 2020 16:04:00 +0900"
[팩트체크] 인터넷에 퍼진 '<b>윤석열</b> 검찰의 수사법' 따져봤더니,http://yna.kr/AKR20201210104800502?did=1195m,https://news.naver.com/main/read.nhn?mode=LSD&mid=sec&sid1=102&oid=001&aid=0012073612,반면 여권 인사가 관련된 '정경심(조국 전 법무장관 <b>부인</b>) 동양대 교수 표창장 위조 의혹 사건'과 '김경수... 다만 '<b>윤석열</b> 총장 장모 사문서위조 의혹 사건'과 '김성태 전 의원 <b>자녀</b> 취업청탁 의혹 사건'에 대해서는 CG에... ,"Thu, 10 Dec 2020 17:37:00 +0900"
&quot;<b>윤석열</b>은 거짓으로 조국을 죽이려 했다&quot;…황교익 SNS글 '파장',http://www.inews24.com/view/1339464,https://news.naver.com/main/read.nhn?mode=LSD&mid=sec&sid1=102&oid=031&aid=0000581831,조 전 장관이 이같은 게시물을 올린 이유는 자신의 <b>부인</b> 정경심 동양대 교수가 사모펀드 의혹과 연관이 없었다는 사실을 피력하기 위한 것으로 해석된다. 앞서 지난 29일 재판부는 정경심 교수와 정 교수 동생 <b>자녀</b>들의... ,"Sun, 31 Jan 2021 13:32:00 +0900"
"'우회로' 택한 서울중앙지검, <b>윤석열</b> 검찰총장 <b>부인</b> 소환할까",http://www.sisajournal.com/news/articleView.html?idxno=207855,https://news.naver.com/main/read.nhn?mode=LSD&mid=sec&sid1=102&oid=586&aid=0000018260,중앙지방검찰청이 <b>윤석열</b> 검찰총장의 <b>부인</b> 김건희씨가 운영하는 코바나컨텐츠에 대한 강제 수사를... 대한 <b>자녀</b> 입시비리 의혹 수사와 코바나컨텐츠의 협찬금 의혹 수사 영장이 연일 법원에서 퇴짜를 맞고 있는 것... ,"Thu, 12 Nov 2020 15:34:00 +0900"
"김진욱, <b>윤석열</b> 징계 관련 &quot;매우 민감한 정치적 사건&quot;",http://www.segye.com/content/html/2021/01/17/20210117510346.html?OutUrl=naver,https://news.naver.com/main/read.nhn?mode=LSD&mid=sec&sid1=102&oid=022&aid=0003543519,후보자가 <b>윤석열</b> 검찰총장의 징계와 관련해 &quot;매우 민감한 정치적 사건&quot;이라는 입장을 내놨다. 김학의 전... 의혹도 <b>부인</b>했다. 그는 &quot;전근과 유학 등으로 주소이전이 잦았던 것은 사실이지만 경제적 이득이나 <b>자녀</b>의 진학을... ,"Mon, 18 Jan 2021 07:01:00 +0900"
"[이슈큐브] 檢, <b>윤석열 부인</b> 회사 과세자료 확보",http://www.yonhapnewstv.co.kr/MYH20201111012000038/?did=1825m,https://news.naver.com/main/read.nhn?mode=LSD&mid=sec&sid1=102&oid=422&aid=0000456316,"&lt;질문 1-1&gt; 서울중앙지검이 <b>윤석열</b> 검찰총장 <b>부인</b>이 운영하는 사무실과 관련 회사에 대해 압수수색 영장을... 민생경제연구소 등이 <b>자녀</b> 관련 입시 비리·부정채용 의혹 관련해 검찰에 고발했는데요, 법원의 기각 사유... ","Wed, 11 Nov 2020 14:39:00 +0900"
"<b>부인</b> 구속에도…조국, 새해 들어 활발한 SNS 활동",https://www.hankyung.com/society/article/2021010812717,https://news.naver.com/main/read.nhn?mode=LSD&mid=sec&sid1=102&oid=015&aid=0004480506,장관은 <b>부인</b>이 구속된 후 본인의 의견을 밝히기보다는 여권에 유리한 기사 등을 공유하는 방식으로 SNS 활동을 이어가고 있다. 지난달 23일 서울중앙지법 형사합의 25-2부(부장판사 임정엽·권성수·김선희)는 <b>자녀</b>... ,"Fri, 08 Jan 2021 13:13:00 +0900"
"<b>윤석열</b> 총장의 위기, 자업자득이다",http://www.ohmynews.com/NWS_Web/View/at_pg.aspx?CNTN_CD=A0002696574&CMPT_CD=P0010&utm_source=naver&utm_medium=newsearch&utm_campaign=naver_news,https://news.naver.com/main/read.nhn?mode=LSD&mid=sec&sid1=102&oid=047&aid=0002293233,그러나 <b>윤석열</b> 검찰이 팔순 노모부터 아내와 <b>자녀</b>들은 물론 동생의 <b>부인</b>까지 탈탈 털었지만 조 전 장관은 끝끝내 버텼다. 자업자득 그러자 인사청문회 당일 정 전 교수를 소환 조사 없이 기소했고 이후 구속까지... ,"Thu, 26 Nov 2020 07:36:00 +0900"
"<b>윤석열</b> 복귀 다음날, '조선일보 방상훈 만남' 꺼내든 與",http://www.mediatoday.co.kr/news/articleView.html?idxno=210637,https://news.naver.com/main/read.nhn?mode=LSD&mid=sec&sid1=100&oid=006&aid=0000105673,대주주로 <b>부인</b> 고 이미란씨에 대해 <b>자녀</b>들이 저지른 학대 배후라는 의혹이 있는데 경찰은 피의자인 방씨 <b>자녀</b>에게 공동존속 상해 혐의를 적용해 기소의견 송치했지만 <b>윤석열</b> 중앙지검은 강요 혐의로 이들을 기소했다가... ,"Wed, 02 Dec 2020 11:59:00 +0900"
<b>윤석열</b> &quot;옵티머스 수사팀 증원&quot;…與 &quot;장모 수사지시도&quot;,https://news.imaeil.com/Society/2020101313313462272,https://news.naver.com/main/read.nhn?mode=LSD&mid=sec&sid1=102&oid=088&aid=0000667265,13일 <b>윤석열</b> 검찰총장이 1조원대 옵티머스 펀드 사기 의혹 사건의 수사팀 규모를 대폭 늘리라고 지시한 가운데 &quot;장모의 주가조작 의혹에 대한 엄정한 수사 지시를 기다린다&quot;고 했다. 민주당은 윤 총장의 장모와 <b>부인</b> 김건희... ,"Tue, 13 Oct 2020 13:32:00 +0900"
"박상기 최초 증언 &quot;<b>윤석열</b>, '조국 사태' 첫날에 조국 낙마 요구&quot;",https://newstapa.org/article/lM3g-,https://news.naver.com/main/read.nhn?mode=LSD&mid=sec&sid1=102&oid=607&aid=0000000552,"반면에 초기부터 터져나온 사모펀드 관련 의혹, 다시말해 조국 후보자 <b>부인</b>인 정경심 당시 동양대 교수가... 후보자 <b>자녀</b>의 입시비리와 관련된 곳이었다. 박상기, “<b>윤석열</b>, ‘부부일심동체’ 거론하며 사모펀드 의혹만... ","Thu, 02 Jul 2020 16:53:00 +0900"
"박상기 &quot;<b>윤석열</b>, 조국 낙마 운운&quot;…대검 &quot;그런말 안했다&quot;(종합)",http://www.newsis.com/view/?id=NISX20200702_0001082143&cID=10201&pID=10200,https://news.naver.com/main/read.nhn?mode=LSD&mid=sec&sid1=102&oid=003&aid=0009947945,당일 <b>윤석열</b> 검찰총장으로부터 '조국은 장관후보에서 낙마해야 한다'는 취지의 말을 들었다고 밝혔다. 대검찰청은 조 전 장관을 선처해달라는 요청에 원론적 답변을 했을 뿐이라며 사실을 <b>부인</b>했다. 대검찰청은 2일 박 전... ,"Thu, 02 Jul 2020 19:23:00 +0900"
[사설]임기 도중 물러난 <b>윤석열</b>… ‘산 권력’ 수사는 흔들림 없게,https://www.donga.com/news/article/all/20210305/105729667/1,https://news.naver.com/main/read.nhn?mode=LSD&mid=sec&sid1=110&oid=020&aid=0003342448,<b>윤석열</b> 검찰총장이 임기를 4개월 남겨두고 어제 물러났다. 윤 총장은 “이 나라를 지탱해온 헌법정신과 법치... 점은 <b>부인</b>하기 어렵다. 문재인 대통령이 윤 총장의 사의를 즉각 수용함에 따라 조만간 후임 총장 인선 절차가... ,"Fri, 05 Mar 2021 03:02:00 +0900"
"중앙지검, 나경원·<b>윤석열 부인</b> 압수수색 영장 잇따라 기각",http://news.kbs.co.kr/news/view.do?ncd=5045452&amp;ref=A,https://news.naver.com/main/read.nhn?mode=LSD&mid=sec&sid1=102&oid=056&aid=0010932068,서울중앙지검이 청구한 나경원 전 의원과 <b>윤석열</b> 검찰총장 주변 수사와 관련된 압수수색영장이 잇따라 기각됐습니다. 법조계에 따르면 나 전 의원의 <b>자녀</b> 관련 입시 비리·부정채용 의혹 등을 수사 중인 중앙지검... ,"Wed, 11 Nov 2020 08:12:00 +0900"
"조국 &quot;언론, <b>윤석열</b>·나경원에 차분한 태도…애완견 취재&quot;",http://news.mt.co.kr/mtview.php?no=2020111510190951691,https://news.naver.com/main/read.nhn?mode=LSD&mid=sec&sid1=100&oid=008&aid=0004499724,"조국 전 법무부 장관이 최근 <b>윤석열</b> 검찰총장 가족과 나경원 전 자유한국당 원내대표 <b>자녀</b>문제 수사에 대한... 장모와 <b>부인</b>, 그리고 나 전 원내대표 관련 가족 의혹에 대해 검찰 수사가 진행되는데, 언론은 유례없이 차분한... ","Sun, 15 Nov 2020 10:41:00 +0900"
"진혜원, <b>윤석열</b> 복귀에 &quot;불공평 천지 만끽해도 된다는 건가&quot;",http://www.fnnews.com/news/202012250728384398,https://news.naver.com/main/read.nhn?mode=LSD&mid=sec&sid1=102&oid=014&aid=0004553580,추미애 법무부 장관 라인으로 분류되는 진혜원 서울동부지검 부부장검사는 법원이 <b>윤석열</b> 검찰총장에 대한... 이는 법원이 조국 전 법무부 장관의 <b>부인</b>인 정경심 동양대 교수가 <b>자녀</b> 입시비리 등으로 징역 4년에 벌금... ,"Fri, 25 Dec 2020 08:04:00 +0900"
정경심 유죄에 혼란 빠진 與…&quot;<b>윤석열</b>이 노린 게 이런 것&quot;,https://www.hankyung.com/politics/article/2020122308817,https://news.naver.com/main/read.nhn?mode=LSD&mid=sec&sid1=100&oid=015&aid=0004472371,<b>자녀</b> 입시 비리와 사모펀드 투자 관련 혐의로 재판에 넘겨진 조국 전 법무부 장관의 <b>부인</b> 정경심 동양대 교수... 김용민 &quot;<b>윤석열</b> 판사 사찰이 노린 게 이런 것&quot; '조국 백서' 제작에 참여하기도 했던 김남국 민주당 의원도... ,"Wed, 23 Dec 2020 16:53:00 +0900"
"秋, 야당공격에 “장편소설” <b>윤석열</b> 의혹엔 “신속 수사”",http://news.kmib.co.kr/article/view.asp?arcid=0015100276&code=61111111&cp=nv,https://news.naver.com/main/read.nhn?mode=LSD&mid=sec&sid1=100&oid=005&aid=0001370037,또 “제가 지시를 했었다면 보좌관도 ‘지시를 이행했다’고 답했을 것”이라며 거듭 <b>부인</b>했다. 추 장관은... 김용민 더불어민주당 의원이 <b>윤석열</b> 검찰총장의 아내·장모 의혹을 묻자 추 장관은 “많은 부분이 이미... ,"Mon, 12 Oct 2020 16:40:00 +0900"
"'나경원 <b>자녀</b> 의혹' 수사 속도 내나…검찰, 고발인 재조사",http://www.yonhapnewstv.co.kr/MYH20200918016700641/?did=1825m,https://news.naver.com/main/read.nhn?mode=LSD&mid=sec&sid1=102&oid=422&aid=0000448446,서울중앙지검이 나경원 전 미래통합당 의원의 <b>자녀</b> 입시비리 등 의혹 사건과 관련해 수사팀을 교체하고... &lt;정청래 / 더불어민주당 의원&gt; &quot;<b>윤석열</b> 총장은 수사 의지가 강력한데 장관이 만류하고 있는 건 아니죠?&quot; &lt;추미애... ,"Fri, 18 Sep 2020 18:45:00 +0900"
<b>윤석열 부인</b> 회사 압수수색 영장 법원서 통째 기각,http://news.kmib.co.kr/article/view.asp?arcid=0924164341&code=11131900&cp=nv,https://news.naver.com/main/read.nhn?mode=LSD&mid=sec&sid1=102&oid=005&aid=0001379740,검찰이 <b>윤석열</b>(사진) 검찰총장 <b>부인</b> 김건희씨가 운영하는 전시기획사에 대한 압수수색 영장을 청구했다가... 한편 서울중앙지검 형사7부(부장검사 이병석)는 나경원 전 미래통합당(현 국민의힘) 의원 <b>자녀</b> 의혹과 관련해 나... ,"Wed, 11 Nov 2020 04:07:00 +0900"
"<b>윤석열</b> 총장의 구구절절 맞는 말, 다만 중요한 게 빠졌다",http://www.ohmynews.com/NWS_Web/View/at_pg.aspx?CNTN_CD=A0002690253&CMPT_CD=P0010&utm_source=naver&utm_medium=newsearch&utm_campaign=naver_news,https://news.naver.com/main/read.nhn?mode=LSD&mid=sec&sid1=102&oid=047&aid=0002290901,재개한 <b>윤석열</b> 검찰총장이 29일 오후 대전지방검찰청에서 지역 검사들과 간담회를 한 뒤 기념사진을 찍고... 주장에서 중요한 건 객관적 사실이나 <b>부인</b>할 수 없는 증거다. 재판도 마찬가지다. 재판에 선 검사가 느낌과... ,"Fri, 06 Nov 2020 18:23:00 +0900"
[일지] 조국 법무부장관 지명부터 <b>부인</b> 정경심 1심 선고까지,https://www.news1.kr/articles/?4159693,https://news.naver.com/main/read.nhn?mode=LSD&mid=sec&sid1=102&oid=421&aid=0005067276,"중&quot; ▶25일 -<b>윤석열</b> “조국 일가 수사, 절차 따라 진행되고 있다&quot; 첫 공개 언급 ▶26일 -조국, 자택 압수수색... 소환조사…<b>부인</b>·<b>자녀</b> 의혹 관련 10시간30분 조사 ▶13일 -검찰, 유재수 전 부시장 기소…뇌물수수... ","Wed, 23 Dec 2020 15:25:00 +0900"
"추미애, <b>윤석열</b> 겨냥 &quot;사과하게 만들 것…스스로 정치적 중립 훼손&quot;(종합)",https://www.news1.kr/articles/?4110309,https://news.naver.com/main/read.nhn?mode=LSD&mid=sec&sid1=100&oid=421&aid=0004973655,"장관) <b>자녀</b>의 표창장을 위조했다', '혐의자가 <b>부인</b>이다'라고 하는 것이 무슨 살아있는 권력에 대한 수사인가&quot;라고 반박했다. 조 의원이 '공정에 반하는 것'이라고 지적하자 답변을 아끼던 추 장관은 &quot;공정에 반하기 이전에... ","Thu, 05 Nov 2020 18:36:00 +0900"
<b>윤석열</b> 장모 잔고증명서 인터넷 그림 캡처해 위조,http://www.hani.co.kr/arti/society/society_general/933413.html,https://news.naver.com/main/read.nhn?mode=LSD&mid=sec&sid1=102&oid=028&aid=0002490115,받는 <b>윤석열</b> 검찰총장의 장모 최아무개(74)씨 쪽이 인터넷 캡처 방식을 통해 가짜 증명서를 만든 것으로... 이는 조국 전 법무부 장관의 <b>부인</b> 정경심 동양대 교수가 <b>자녀</b>의 표창장 직인을 위조했다는 방식과 비슷하다.... ,"Fri, 20 Mar 2020 05:04:00 +0900"
"나경원, <b>자녀</b> 사건 관련 공격하는 여당에 “내가 조국처럼 살았나”",https://www.chosun.com/politics/2020/11/13/FVF47ASRQRFFPLRVPEZFE3BD5U/?utm_source=naver&utm_medium=original&utm_campaign=news,https://news.naver.com/main/read.nhn?mode=LSD&mid=sec&sid1=100&oid=023&aid=0003576004,나경원 전 의원이 13일 자신의 <b>자녀</b> 관련 검찰 수사에 대한 여권의 공격에 대해 “내가 조국처럼 살았나”라고 했다. 더불어민주당 김종민 최고위원이 이날 당 최고위원회의에서 “<b>윤석열</b> 검찰총장의 장모와 <b>부인</b>에 대한... ,"Fri, 13 Nov 2020 15:35:00 +0900"
[금일 정치권 주요기사] 정총리 LH사태에 &quot;범죄와의 전쟁&quot; 선포...추미애 &quot;윤...,http://www.youthdaily.co.kr/news/article.html?no=64801,http://www.youthdaily.co.kr/news/article.html?no=64801,"&quot;김승연 전 교수는 2000년 즈음에 박 후보의 <b>부인</b>이 딸과 함께 실기시험이 끝나고 딸을 찾아와 '잘 봐달라', '우리 딸 떨어지면 안 된다'고 했다는 청탁이 있었다고 한다&quot;며 &quot;떳떳하다면 <b>자녀</b> 인적 사항, 홍대 입시 응시 여부... ","Thu, 11 Mar 2021 18:00:00 +0900"
&quot;불법기소&quot; 법정서도 <b>윤석열</b> 때린 최강욱···檢 &quot;근거 있냐&quot;,https://news.joins.com/article/olink/23353822,https://news.naver.com/main/read.nhn?mode=LSD&mid=sec&sid1=102&oid=025&aid=0002994561,혐의를 <b>부인</b>했다. 검찰의 기소를 &quot;윤 총장의 지시를 받은 불법적인 기소&quot;라 주장했다. 최 당선인은 21대 총선 당선인 중 가장 먼저 피고인 신분으로 법원에 출석한 1호 당선인이 됐다. ━ 법원에서도 <b>윤석열</b> 때린 최강욱 21일... ,"Tue, 21 Apr 2020 12:00:00 +0900"
<b>윤석열</b> 측근 윤대진도 법무부 간부에게 '조국 사퇴' 압박 의혹,https://newstapa.org/article/7uLLQ,https://news.naver.com/main/read.nhn?mode=LSD&mid=sec&sid1=102&oid=607&aid=0000000556,"날, <b>윤석열</b> 검찰총장이 사모펀드 문제를 제기하며 조국 후보의 낙마를 요구했다”고 말한 바 있다. 언론을 통해 당시 한창 논란이 가열되던 조국 후보자 <b>자녀</b>의 입시문제 등에 대해서는 별말 없이 1시간 넘게 사모펀드... ","Tue, 07 Jul 2020 17:21:00 +0900"
"최강욱, 첫 재판서 혐의 전면 <b>부인</b>…&quot;이미 시민 심판 이뤄져&quot;",http://news.tvchosun.com/site/data/html_dir/2020/04/21/2020042190097.html,https://news.naver.com/main/read.nhn?mode=LSD&mid=sec&sid1=102&oid=448&aid=0000296107,"공소사실을 <b>부인</b>했습니다. 조국 전 법무장관 아들이 실제로 인턴생활을 했으니 위계, 즉 속임수가 아니고, 지원하려는 학교나 학과를 알지 못했으니 업무방해 고의도 없었다고 주장했습니다. 또, 조 전 장관 <b>자녀</b>에게... ","Tue, 21 Apr 2020 21:17:00 +0900"
문 대통령 &quot;검찰 신뢰받을 방안 마련&quot;…<b>윤석열</b>에 지시,http://news.jtbc.joins.com/article/article.aspx?news_id=NB11887334,https://news.naver.com/main/read.nhn?mode=LSD&mid=sec&sid1=100&oid=437&aid=0000220775,"야권은 조 장관의 <b>부인</b>인 정경심 동양대 교수와 딸인 조모 씨, 5촌 조카, 한인섭 서울대 법대 교수, 코링크PE 대표 등을 주요 증인으로 요구하고 있죠. 반면 민주당은 '국회의원 <b>자녀</b> 입시비리 전수조사' 추진 카드를... ","Mon, 30 Sep 2019 18:36:00 +0900"
"대검 &quot;<b>윤석열</b> 총장, 박상기 전 장관에게 '조국 낙마시켜야 한다'고 말한 적 없...",http://www.segye.com/content/html/2020/07/02/20200702524012.html?OutUrl=naver,https://news.naver.com/main/read.nhn?mode=LSD&mid=sec&sid1=102&oid=022&aid=0003480813,당일 <b>윤석열</b> 검찰총장으로부터 '조국은 장관후보에서 낙마해야 한다'는 취지의 말을 들었다고 밝혔다. 대검찰청은 조 전 장관을 선처해달라는 요청에 원론적 답변을 했을 뿐이라며 사실을 <b>부인</b>했다. 대검찰청은 2일 박 전... ,"Fri, 03 Jul 2020 08:02:00 +0900"
최강욱 &quot;법정 설 사람은 정치검사&quot;…첫 재판서 혐의 전면 <b>부인</b>(종합),http://yna.kr/AKR20200421054951004?did=1195m,https://news.naver.com/main/read.nhn?mode=LSD&mid=sec&sid1=102&oid=001&aid=0011561526,그는 &quot;<b>윤석열</b> 검찰총장의 지시에 따른 정치검찰의 불법적이고 정치적 기소로 저는 오늘 법정으로 간다&quot;며... 최 전 비서관 측은 공판에서 이런 혐의도 전면 <b>부인</b>했다. 최 전 비서관의 변호인은 &quot;조씨는 실제로 16시간정도... ,"Tue, 21 Apr 2020 11:03:00 +0900"
"&quot;최강욱 비서관 기소하라&quot;…<b>윤석열</b> 총장, 직접 지시했다(종합)",http://www.newsis.com/view/?id=NISX20200123_0000898160&cID=10201&pID=10200,https://news.naver.com/main/read.nhn?mode=LSD&mid=sec&sid1=102&oid=003&aid=0009668762,"최 비서관은 법무법인 청맥 소속 변호사로 활동하던 시절, 조 전 장관의 <b>부인</b>인 정경심 동양대학교 교수의 부탁을 받고 아들 조모씨의 허위 인턴 증명서를 발급해준 혐의를 받는다. <b>자녀</b> 입시 의혹 등으로 지난달 기소된 조... ","Thu, 23 Jan 2020 15:26:00 +0900"
최강욱 &quot;법정 설 사람은 정치검사&quot;…첫 재판서 혐의 전면 <b>부인</b>(종합2보),http://yna.kr/AKR20200421054952004?did=1195m,https://news.naver.com/main/read.nhn?mode=LSD&mid=sec&sid1=102&oid=001&aid=0011561741,"&quot;시민 심판 이미 이뤄졌다&quot;…&quot;조국 아들, 실제 인턴활동 했다&quot; &quot;<b>윤석열</b> 고발, 적절한 시기 생각하고 있다... 최 전 비서관 측은 공판에서 이런 혐의도 전면 <b>부인</b>했다. 최 전 비서관의 변호인은 &quot;조씨는 실제로 16시간정도... ","Tue, 21 Apr 2020 11:47:00 +0900"
<b>윤석열</b>의 빅픽처? 그가 알려준 11가지,http://www.ohmynews.com/NWS_Web/View/at_pg.aspx?CNTN_CD=A0002652557&CMPT_CD=P0010&utm_source=naver&utm_medium=newsearch&utm_campaign=naver_news,https://news.naver.com/main/read.nhn?mode=LSD&mid=sec&sid1=102&oid=047&aid=0002274337,'검찰주의자' <b>윤석열</b>의 시간 ▲  <b>윤석열</b> 검찰총장이 22일 오후 청와대에서 열린 제6차 공정사회... 법을 어겼다 여기면 검찰이 현직 법무부장관 <b>부인</b>도 '소환조사 없이' '선택적 기소' 할 수 있음을 온 국민이 알게 됐다.... ,"Wed, 24 Jun 2020 08:05:00 +0900"
