title,originallink,link,description,pubDate
"<b>윤석열 부인</b> 의혹사건 2건… 檢, 반부패수사2부에 배당",https://www.donga.com/news/article/all/20201106/103825822/1,https://news.naver.com/main/read.nhn?mode=LSD&mid=sec&sid1=102&oid=020&aid=0003318931,추미애 법무부 장관이 수사지휘권을 발동한 <b>윤석열</b> 검찰총장의 <b>부인</b> 김건희 씨 고발 사건 2건이 모두 서울중앙지검의 반부패수사2부에 배당됐다. 반부패수사2부는 지난해 조국 전 법무부 장관 일가의 의혹 사건을... ,"Fri, 06 Nov 2020 03:01:00 +0900"
檢 '나경원 <b>자녀</b> 입시비리 의혹' 수사 속도…딸 대학 교직원 조사,https://www.news1.kr/articles/?4069279,https://news.naver.com/main/read.nhn?mode=LSD&mid=sec&sid1=102&oid=421&aid=0004891851,검찰이 나경원 전 미래통합당(현 국민의힘) 의원의 <b>자녀</b> 입시비리 의혹과 관련해 딸이 다닌 대학 관계자들에... 사건 수사가 진척되지 않는다'고 지적하자 &quot;제가 (<b>윤석열</b> 검찰총장의) 수사 의지를 본 적이 없다&quot;고 밝혔다.,"Thu, 24 Sep 2020 14:26:00 +0900"
‘확진’ 운전기사 접촉…‘<b>윤석열</b> 측근’ 윤대진 검사장 자가격리,http://www.segye.com/content/html/2020/08/24/20200824512847.html?OutUrl=naver,https://news.naver.com/main/read.nhn?mode=LSD&mid=sec&sid1=102&oid=022&aid=0003496415,24일 오전 코로나19 검사받고 자택 대기 중 <b>윤석열</b> 검찰총장(왼쪽)과 윤대진 사법연수원 부원장(검사장)... <b>부인</b> 최은주 서울중앙지법 부장판사도 이날 공가를 낸 뒤 자택에서 대기하고 있다. A씨는 지난 18일 <b>자녀</b>가... ,"Mon, 24 Aug 2020 13:44:00 +0900"
檢 조국 <b>부인</b> 정경심 세번째 소환,http://www.yonhapnewstv.co.kr/MYH20191008006100038/?did=1825m,https://news.naver.com/main/read.nhn?mode=LSD&mid=sec&sid1=102&oid=422&aid=0000395783,검찰이 조국 법무부 장관의 <b>부인</b> 정경심 동양대 교수를 세 번째로 소환해 조사 중입니다. 지난 5일 2차 소환... 이미 <b>윤석열</b> 검찰총장이 지난 4일 피의자 등에 대한 공개소환을 전면 폐지할 것을 전국 검찰청에 지시한 만큼... ,"Tue, 08 Oct 2019 11:22:00 +0900"
수호? 퇴진?… <b>윤석열</b>의 '직진' 어떤 결과 만드나,http://www.segye.com/content/html/2019/09/29/20190929509249.html?OutUrl=naver,https://news.naver.com/main/read.nhn?mode=LSD&mid=sec&sid1=100&oid=022&aid=0003401385,"<b>윤석열</b>의 직진… “국민 뜻 받들어 檢 개혁… 수사는 원칙대로”/ 尹, 검찰 개혁 관련 첫 입장 표명 / 서초동... 혐의, <b>자녀</b>의 입시와 관련해 업무방해 및 뇌물죄 등의 혐의로 각각 고발된 상태다. 조국 법무부 장관 <b>부인</b>... ","Mon, 30 Sep 2019 06:03:00 +0900"
"檢, <b>윤석열 부인</b> 김건희 '정조준'···&quot;尹 찍어내기&quot; vs &quot;국민적 의혹&quot;",http://www.womaneconomy.kr/news/articleView.html?idxno=95548,http://www.womaneconomy.kr/news/articleView.html?idxno=95548,"제출, <b>윤석열</b> 검찰총장 배우자 김건희 씨 소유의 전기기획사 코바나 컨텐츠의 과세자료를 확보하며 수사에... 의원 <b>자녀</b> 입시의혹 배당 부서) 모두 '이성윤 서울중앙지검' 소속&quot;이라며 &quot;검찰총장 무한핍박, 총장 <b>부인</b>과... ","Wed, 11 Nov 2020 19:05:00 +0900"
“유시민 치자” 채널A기자-<b>윤석열</b> 최측근 유착 의혹…유 입장은?,http://www.edaily.co.kr/news/newspath.asp?newsid=01380886625731856,https://news.naver.com/main/read.nhn?mode=LSD&mid=sec&sid1=102&oid=018&aid=0004610085,기자는 “가족 와이프나 <b>자녀</b>가 마음에 걸리시는 거예요? 아니면 재산 추징 그게 마음에 걸리시는 거예요?... 기자는 “제가 그래도 검찰하고 제일 신뢰 관계 형성 돼 있고 속칭 <b>윤석열</b> 라인이나 기사 보시면 많이 썼어요... ,"Wed, 01 Apr 2020 07:24:00 +0900"
"민주당 김용민, 정경심 구속에 “<b>윤석열</b> 반드시 처벌해야”",http://news.kmib.co.kr/article/view.asp?arcid=0015355323&code=61121311&cp=nv,https://news.naver.com/main/read.nhn?mode=LSD&mid=sec&sid1=102&oid=005&aid=0001393988,김용민 더불어민주당 의원은 23일 조국 전 법무부장관의 <b>부인</b> 정경심 동양대 교수가 <b>자녀</b> 입시비리 혐의로 징역 4년을 선고받고 법정구속되자 “<b>윤석열</b> 검찰총장이 판사 사찰을 통해 노린게 바로 이것”이라며 격앙된... ,"Wed, 23 Dec 2020 15:54:00 +0900"
"‘<b>윤석열</b> 저격수’ 최강욱, 열린민주 비대위원장에",http://www.segye.com/content/html/2020/04/19/20200419515181.html?OutUrl=naver,https://news.naver.com/main/read.nhn?mode=LSD&mid=sec&sid1=100&oid=022&aid=0003457854,연합뉴스 그는 오는 7월 출범 예정인 공수처가 생기면 <b>윤석열</b> 검찰총장이 공수처 수사 대상 1호가 될 수 있다는 발언으로 논란을 빚었다. 4·15총선 직전에는 윤 총장의 <b>부인</b> 김건희 코바나컨텐츠 대표를 주가조작 혐의로... ,"Sun, 19 Apr 2020 20:42:00 +0900"
정경심 이번주 소환될듯…<b>윤석열</b> &quot;검찰개혁 최선 다할 것&quot;,https://www.nocutnews.co.kr/news/5220195,https://news.naver.com/main/read.nhn?mode=LSD&mid=sec&sid1=102&oid=079&aid=0003274839,사모펀드 및 <b>자녀</b>입시 관련 의혹에 연루된 조국 법무부장관의 <b>부인</b> 정경심 동양대 교수가 이르면 이번주 검찰에 출석해 조사를 받을 것으로 보인다. 29일 법조계에 따르면 서울중앙지검 특수2부(고형곤 부장검사)는 정... ,"Sun, 29 Sep 2019 15:59:00 +0900"
조국 <b>부인</b> 세 번째 소환…동생 심사포기,http://www.yonhapnewstv.co.kr/MYH20191008011900038/?did=1825m,https://news.naver.com/main/read.nhn?mode=LSD&mid=sec&sid1=102&oid=422&aid=0000395828,검찰이 조국 법무부 장관의 <b>부인</b> 정경심 동양대 교수를 소환해 조사 중입니다. 이번이 세 번째인데요. 지난... <b>윤석열</b> 검찰총장이 지난 4일 피의자 공개소환을 전면 폐지할 것을 전국 검찰청에 지시한 만큼 정 교수의 비공개... ,"Tue, 08 Oct 2019 16:37:00 +0900"
"유시민 &quot;<b>윤석열</b> 검찰, 총·칼 안 들었으나 위헌적 쿠데타&quot;",http://www.fnnews.com/news/201909291020583647,https://news.naver.com/main/read.nhn?mode=LSD&mid=sec&sid1=102&oid=014&aid=0004301702,"조 장관에 대한 수사를 벌이고 있는 <b>윤석열</b> 검찰 총장에 대한 비판도 이어갔다. 유 이사장은 &quot;윤 총장이 너무... 그는 또 &quot;조 장관에 대한 범죄 연루가 어려우니 <b>부인</b>, <b>자녀</b> 문제로 도덕적 비난을 받게 하려는데 이는 가족... ","Sun, 29 Sep 2019 10:22:00 +0900"
"민주당, <b>윤석열</b> 향해 &quot;장모의 주가조작 의혹에 대한 엄정한 수사 지시 기다린...",http://www.segye.com/content/html/2020/10/13/20201013513317.html?OutUrl=naver,https://news.naver.com/main/read.nhn?mode=LSD&mid=sec&sid1=100&oid=022&aid=0003512283,"의원 <b>자녀</b>, 박덕흠 의원 등에도 동일한 원칙이 적용된 수사 지시를 내려줄 것을 촉구한다&quot; <b>윤석열</b> 검찰총장.... 윤 총장의 장모와 <b>부인</b> 김건희씨는 도이치모터스의 주가 조작에 관여했다거나 파주 의료법인 비리에... ","Wed, 14 Oct 2020 06:01:00 +0900"
