text,created_at
"몇 몇은 <b>윤석열 테마주</b>라는 추측을 고수하고 있지만 정확히 어떠한 소재로 상승하는지 아직 나오지 않았다. 일각에선 윤석열 前총장의 충청 대망론이 거론되면서 충청에 있는 네오오토가 관련주다, 또는... ",20210317
받으면서 ‘<b>윤석열 테마주</b>’로 분류되던 웅진 계열사의 주가 역시 급등세를 나타낸 것으로 보이는데... 정치인 테마주가 점점 코미디가 되어가는데 윤석열 전 총장과 인연과 지연을 통해 연결되는 것이... ,20210308
오늘 포스팅 주제는 &quot;윤석열 관련 정치테마주 5종목 정리 &amp; 주가상황 파악&quot; -서이추는 늘 환영합니다♥ ʕ•ᴥ•ʔ - #정치테마주 #윤석열관련주 #<b>윤석열테마주</b> #테마주 #덕성 #서연 *해당 포스팅은 투자를... ,20210307
<b>윤석열 테마주</b> 1. NE능률 - 무려 최근에 3연상. ne능률은 최대주주가 윤석열 전 총장과 같은 파평 윤씨... 윤석열 전 검찰총장은 아무런 관련이 없다고 언급했음에도 상한가 기록. 2. 금강철강 - 윤석렬 테마주... ,20210309
"어제부터 상한가를 찍어대고 있는 정치<b>테마주</b> 입니다. 저 개인적으로 정치 <b>테마주</b> 비추하는... 관심이 없는 종목이다보니 제반 지식 없이, <b>윤석열</b> 테마고 뭐고, 다 제끼고 차트만 보고 얘기해보겠습니다.... ",20210305
그냥 테마주로 보고 들어간 사람들 물린 경우 많았을 듯 극동유화는 평소에 얼마나 거래량이 없던지 얼마 미만에 사서 얼마 이상에 팔면되는 내 나름에 공식이 있었음. 그런데 이 주식이 <b>윤석열 테마주</b>로... ,20210316
"대법관과 윤석열 전 검찰총장과의 인연을 거론하며, &quot;<b>윤석열 테마주</b>&quot;로 급등했다는 기사가 일부... 생각지도 않았지만 대선 테마주에 올라타게 되었다. (이거 뭔가 도이치모터스랑 비슷하다...) 순간의 급등이... ",20210313
한국 정치권 '대장'으로 떠오르고 있는 윤석열 전 검찰총장! '<b>윤석열 테마주</b>'도 한국 주식에 돌풍을 일으키고 있습니다! 바로 초강세 예정인 '<b>윤석열 테마주</b>' 더 늦기 전에 선착순 무료로 받아가세요!,20210310
"39% 파평윤씨 테마주 교육, 놀이의발견 물적 분할 - 판관비 증가로 영업이익 감소 윤석열 관련주는 하나 같이 재무제표가 엉망이네요. 구 <b>윤석열 테마주</b>인 서연, 서연탑메탈, 서연이화 등은 이전부터 상당히... ",20210309
윤석열 관련주가 난리났네요. 끝물이 온건지 이 종목 저 종목 전부 윤석열 관련주로 엮여서 상승... 현재 <b>윤석열 테마주</b> 중 대장주는 NE능률로 보입니다. 테마주 중 대장은 항상 제일 많이 올라가고 제일 덜 빠진... ,20210309
'주민이는 주식의민족의 블로그 별명 입니다' 안녕하세요 주민이입니다 오늘은 주식의민족 <b>테마주</b>검색기 상위에 위치한 <b>윤석열</b> 테마 관련주에 대해서 알아보겠습니다 알아보기 전 어떤 이유로 <b>테마주</b>검색기... ,20210309
원익큐브도 엇그제 상한가종목으로 정리해드렸는데 오늘 <b>윤석열</b> 관련주로 새롭게 부각이 되면서 주가는 오늘도 상한가 마감했고 푸른저축은행도 차트를 보시면 4거래일 연속 상승중입니다. 정치<b>테마주</b>로... ,20210311
"<b>윤석열 테마주</b> 1탄 - 모베이스전자 <b>윤석열 테마주</b> 2탄 - 덕성, 덕성우 서연이 윤석열 관련주인 이유... 정치 테마주로 묶였는가?를 보는건 큰 의미가 없습니다. 해당 종목이 관련주로 묶인 것으로 시장이... ",20201104
이제는 <b>윤석열 테마주</b>를 넘어 파평윤씨 테마주가 셍겼다는 우스겟 소리가 나올만큼 투자자들이 막지르는 느낌입니다 이런 정치인 테마주들은 공약으로 정책적 뒷받침이 되지 않는 단순 최대주주나... ,20210310
시점에서 윤석열 검찰총장 관련주들의 상황은 어떠할까? 대표적인 <b>윤석열 테마주</b> 서연 삼총사이다. 어느정도 상승세를 보이고는 있지만 글쎄..? 정치 테마주임을 감안했을 때 이정도는 슈팅이라고 할 수 없다... ,20200916
정치인 테마주로 폭등 하기도 하고 폭락 하기도 한답니다. 화천기계 화천기계 지배 회사인 화천기공의 회장과 윤석열 전 검찰총장이 동문이라는 이야기가 있어 화천기계가 <b>윤석열 테마주</b>중 하나라고 하는데요..... ,20210311
[국내주식] <b>윤석열 테마주</b> (Feat. 정계 진출?) 윤석열 총장과 관련된 테마주 두 번째는 '덕성'이다. 역시 상한가를 쳤다. 1966년 설립된 회사로 국내외 다수의 기업에 대하여 합성피혁 및 합성수지의 판매를... ,20210304
"윤석열지지율, <b>윤석열테마주</b>, 서연탑메탈, NE능률 주가전망, 투자경고종목 지정예고 윤석열지지율... 윤석열 관련주, 테마주들은 이전부터 윤석열 때리기 할 때마다 급등락을 반복했습니다. 그 이유는 사퇴로... ",20210305
오늘 <b>윤석열 테마주</b>로 편입되어 가장 먼저 상한가를 간 종목이다. 최대주주 윤정선씨가 파평 윤씨가... 시총이 작은 정치테마주의 경우에는 더더더더욱 그러하다. 속일수 없는것을 한가지 뽑으라면... ,20210310
"윤석열 관련주 테마주 1. 푸른저축은행 푸른저축은행의 사외이사인 안대희 전 대법관이 대검찰청... 과연 <b>윤석열 테마주</b>는 투자할만한가? 많은 테마주들이 뜨고, 지고 있습니다. 그 중에서 <b>윤석열테마주</b>는... ",20210320
때아닌 #테마주 이슈에 휘말리고 있다. 윤석열 전 검찰총장 때문이다. 웅진그룹의 지주사인 웅진은 윤... 웅진그룹이 <b>윤석열 테마주</b>로 분류돼 시장에서 관심을 받고 있는 이유는 이렇다. 웅진 창업주인... ,20210310
"검찰총장 옷 벗은 유력 대권 후보, <b>윤석열 테마주</b>를 알아보자!!! 2013년 국정 감사장에서 &quot;사람에게... #윤석열 관련주 #윤석열 정치테마주 #정치테마주 #인맥주 #윤석열 대권 #윤석열 신규 # 테마주",20210305
윤석열 총장이랑 남성 사외이사 윤봉수 님이랑 서울대 법대 동문입니다. 약간 러셀이랑 비슷한 움직임을 보이고 있네요. 마지막으로 덕성우 종목도 있습니다. 종목들이 이재명 테마주로 불리다가 <b>윤석열 테마주</b>... ,20210120
"파평윤씨 소정공파, 파평 윤씨 관련주 - <b>윤석열 테마주</b> 파평윤씨-관련주-윤석열-관련주-파평윤씨... 윤석열-전-총장 맺음말 파평윤씨 관련주, 윤석열 관련주 파평윤씨-대선테마주 최근 윤석열 전 총장의 대권... ",20210316
"테마는 <b>윤석열 테마주</b>라고 볼 수 있겠습니다. 지난주 급등이 나왔던 서연탑메탈, 서연, 덕성, NE능률... 서연탑메탈은 윤석열 대장주로 시세가 쉽게 꺾이지 않는 상황인 것 같습니다. 저도 정치테마주는... ",20210308
바랍니다 <b>윤석열 테마주</b> NE능률 덕성 웅진 웅진씽크빅 서연 서연이화 서연탑메탈 모베이스전자 태양금속 아이크래프트 이그잭스 성보화학 #윤석렬테마주 #NE능률 #덕성 #서연 #서연탑메탈 #모베이스전자... ,20210308
"<b>윤석열 테마주</b> 1탄 - 모베이스전자 덕성이 윤석열 관련주인 이유 정치테마주를 들여다 보며 느낀 점 하나는 혈연으로 묶인 관계 (대표이사가 형제/자매 등)가 아니고 학연, 지연 등 사회적으로 맺어진... ",20201103
"관련 테마주인 서연, 덕성, 덕성우, 서연이화, NE능률, 서연탑메탈 등에 투자자들의 관심이 쏠렸다. 서연은 법무법인 광장 변호사인 유재만 사외이사가 윤석열 총장과 동문이라는 이유로 <b>윤석열 테마주</b>가... ",20210305
"지금까지 언급된 '윤석열 관련주'의 수준 이런 상황에서 윤석열 관련주는 실체없는 테마주가 많다. 경영진이 동문, 지인이거나 같은 파평 윤씨라서 <b>윤석열 테마주</b>로 지목되는 경우가 많다. 솔직히 보자.... ",20210318
========================================================= 같은 '파평 尹씨'라서 급등?···<b>윤석열 테마주</b> 경계령... /연합뉴스 윤석열 전 검찰총장이 대권 주자로 급부상하면서 관련 테마주가 기승을 부리고 있다. 특히... ,20210308
금일 윤석열 총장의 사퇴이슈 때문입니다. 정치테마주는 실체가 없고 기대로 움직여 어떻게 보면... 서연 서연 일봉차트 : 서연은 <b>윤석열 테마주</b> 하면 선두로 꼽히던 종목입니다. 이번에도 지난 3월 2일부터... ,20210304
서연이화 #제일테크노스 #진도 #모베이스전자 #에이텍티앤 #오리엔트정공 #신라에스지 #에이텍 #윤석열 #윤석열관련주 #<b>윤석열테마주</b> #이재명 #이재명관련주 #이재명테마주 #주식매매일지 #매매일지,20210304
서연탑메탈 윤석열 정치테마주의 시대 나스닥 100 선물 일봉 차트 보시겠습니다. 헤드 앤 숄더 패턴이... 내용을 확인해보세요 https://www.youtube.com/watch?v=MicQEqQ7AmQ #서연탑메탈 #서연탑메탈주가 #<b>윤석열테마주</b>,20210305
정치인 <b>테마주</b> 넘 어렵기도 하고 대형주만 매매해도 충분하다고 생각해서.. 아마 <b>윤석열</b> 검찰총장이 정치인으로 출마할거라는건 거의 확정적이라는 분위기가 많아서 그때되면 덕성 하늘위로 날라갈 수도... ,20210103
<b>윤석열 테마주</b> 2탄 ~ 오늘은 예상대로 언론에서 윤석열 전 검찰총장 정계 진출에 대한 기사를... 시에는 각별한 주의가 필요하다. #NE능률 #팬엔터테인먼트 #서연 #덕성 #<b>윤석열 테마주</b> # 정치테마주 # 관심주 #대권,20210306
윤석열 전 검찰총장이 총장직을 사퇴한 이후 대권 지지율이 1위를 기록했다는 여론 조사 결과가 나오며 ‘<b>윤석열 테마주</b>’들이 급등하고 있다. 8일 마켓포인트에 따르면 오전 9시 29분 현재 덕성(004830)은... ,20210308
"테마주로 엮이기 전까지는요 서연탑메탈은 윤석열과 아무런 관련이 없습니다. 즉 작전이라는겁니다 테마고. 돈넣고 돈먹기, 도박판 그 자체입니다. 기업의 대표도 아니고 사외이사가 동문인데 #<b>윤석열테마주</b> ???... ",20201216
"안녕하세요 어제 윤석열 전 검찰총장 테마주들이 급등했다면 강력한 차기 대권주자로 거론되는... 이어 이재명 경기지사가 24.1%, 이낙연 대표가 14.9%로 뒤를 이었는데 어제 <b>윤석열 테마주</b>에 몰려갔단... ",20210309
"그럼 다음주 관심갖을만한 윤석열 관련주에는 어떤 종목들이 있는지 자세히 알아보겠습니다 ! 흥국 - 일봉차트인데요, 이미 1월달에 주가가 한번 큰파동이 있었던 종목인데 <b>윤석열테마주</b>로 엮인데다가... ",20210306
"윤석열 정치테마주 : 덕성, 웅진, 덕성우, 서연탑메탈, 서연, 서연이화, 모베이스전자 러시아백신... 아이엠 윤석열 전 검찰총장이 사퇴 후 지지율이 상승하면서 이틀 연속 <b>윤석열테마주</b> 강세 동국알앤에스 : 호주... ",20210308
조사에서 윤석열 전 검찰총장이 50%가 넘는 지지율을 기록했다. 자세한 내용은 중앙선거여론조사심의위원회 홈페이지 등을 참고하면 된다. <b>윤석열테마주</b> 오늘 아침 아톰브이 실시간리딩 정보 : 성보화학... ,20210310
"(지지율 떡상!, <b>테마주</b> 떡상! 으하하하하) 홍준표, 유승민, 안철수, 원희룡 등 기존의 야당 정치인들이 치고 나가지 못하는 이상 <b>윤석열</b>은 대중에게 더 빠르게 그리고 강렬하게 소비될 것이고 이는 꾸준한... ",20201102
"사외이사가 서울대 법대 동문이자 서울중앙지검 부장검사출신이라는 이유로 <b>윤석열 테마주</b>로 분류된다. NE능률 , 성보화학 등은 최대주주나 대표이사가 윤석열 전 총장과 같은 종친이라는 이유만으로 테마주로... ",20210313
부방 <b>윤석열 테마주</b> 관련주는 하락시에 큰 폭으로 뚝뚝 떨어지지 않는다는 점이 공통점 그래서 하루 단타 치시는 분들에게도 꽤 괜찮은 종목중 하나 주의할점은 윤석열 대권 후보주자다 ~ 요것만 가지고는... ,20210317
<b>윤석열 테마주</b> 대장은 누구? 등락율 상위 어렵게 찾을 필요도 없다. 1. 전일 대비 상승률 2. 상한가라면 잔량순위 3. 당일 시가 1등 모베이스전자다. 윤석열 관련주 대장 모베이스전자 차트 2등 아이크래프트... ,20200131
"제일테크노스, NE능률, 한국테크놀로지, 유에스티, 웅진, 아이크래프트, 태양금속, 팬엔터테인먼트 (차트 이미지 넣을까 했는데 귀찮음) #<b>윤석열테마주</b> #윤석열관련주 #대선관련주 #정치테마주 #하지마!",20210305
"윤 전 총장이 유력 대권 후보로 주목을 받으면서 ‘<b>윤석열 테마주</b>’로 분류되던 웅진 계열사의 주가... 서연도 윤석열 관련주로 엮인다. 서연이화, 서연탑메탈도 서연 계열사란 이유로... 정치 테마주는 참... ",20210308
관련 이슈 &lt;기사 내용&gt; 이 대권 주자로 급부상한 윤석열 전 검찰총장 관련주로 엮이면서 장중... 윤 전 총장이 유력 대권 후보로 주목을 받으면서 ‘<b>윤석열 테마주</b>’로 분류되던 웅진 계열사의 주가 역시... ,20210310
"<b>윤석열 테마주</b> 대선출마 기대감에 모두 상한가 서연은 전일 대비 29.95%(3,100원) 급등한 13,450원 서연의... 한국거래소는 테마주 변동을 예의주시하고 있다. 3월4일 윤석열 검찰총장이 사의를 표명하면서 내년... ",20210304
주의할 필요가 있습니다 투자에 참고하세요 윤석열 검찰총장 테마주 덕성 덕성우 서연 서연탑메탈 진도 #윤석열검찰총장테마주 #대선테마주 #정치인테마주 #덕성 #덕성우 #서연 #서언탑메탈 #<b>윤석열테마주</b> #진도,20201111
윤석열 검찰총장이 4일 오후 전격 사퇴 선언을 하면서 관련주로 언급되는 종목들이 들썩였다. 전형적인 정치인 테마주 흐름으로 투자자들의 주의가 요구된다. 4일 소위 <b>윤석열 테마주</b>로 분류되는 서연은... ,20210304
https://io.krible.me/share/FqBpuhaU #<b>윤석열</b> #<b>테마주</b> #급등주 #위험 #주식투자 #주식 #투자 #투자정보 #크리블 #KRiBLE,20210309
"그럼 정치<b>테마주</b>는 <b>윤석열</b> 관련주보다 4월에 있을 선거에 대해 시선을 돌려보는것도 좋겠죠?! 4월에는 보궐선거가 있습니다!! 야권에서는 안철수, 오세훈 후보들이 눈에 띄구요... ",20210309
"[속보] 돌아온 윤석열 &quot;헌법정신·법치주의 수호 위해 최선&quot; : 네이버 뉴스 (naver.com) 왜 호재인가 사실 처음 추미애 장관이 윤석열 총장을 직무 배제 한다는 기사가 떴을 때, <b>윤석열 테마주</b>인 서연탑메탈 등이... ",20201201
<b>윤석열 테마주</b>는 내일 조심해야 된다. 최근 희토류 테마주도 그랬듯이 1등은 상한가를 가지만 2등과 3등주는 다음날 모조리 급락이 나왔다. 오늘 시간외 단일가에서 2등과 3등주는 하한가 근처에 갔듯이 4... ,20210304
"오늘은 윤석열 전 검찰총장 테마만 보면 될 것 같습니다. 지난 화요일부터 뉴스가 계속 나오길래... 무려 네 종목이나 <b>윤석열 테마주</b>네요 관련주 : 덕성, 덕성우, 서연, 서연탑메탈 이 외에도 정말 많은데... ",20210304
이게 머선129 그래서 확인해보니 윤석열 정치테마주로 엮인 것! <b>윤석열 테마주</b> 대장은 서연 아니었나? 뭐지하고 보니 웅진 회장님 성씨가 파평 윤씨로 윤석열과 같은 성이라고.. 오와- 씽크빅이다 진짜... ,20210309
<b>윤석열 테마주</b> 관련하여 거래소에서 대표이사가 &quot;윤&quot;씨인 회사를 찾아 보았다. *노랑색 표시는 <b>윤석열 테마주</b> 대장격인 &quot;남성&quot;처럼 윤씨들이 경영하는 회사임. &lt;&gt;,20210310
테마주' 윤석열 전 검찰총장의 사퇴와 함께 거세졌던 <b>윤석열 테마주</b> 투자열풍이 잠잠해지고 있다. 고점을 찍고 거래량이 감소하면서 하락세에 접어드는 전형적 테마주 흐름이다. 결국 정치인 테마주의... ,20210317
#<b>윤석열테마주</b> #윤석열관련주 #윤석열 #윤석열총장 #윤석열NE능률 거래소에서는 NE늉률에게 주가 급등에 대한 조회공시를 요구했지만 당연히 별 특이사항은 없을것으로 보입니다. 곧 있으면 선거인데 선거... ,20210305
안녕하세요 원익큐브가 <b>윤석열 테마주</b>로 편입되면서 강세를 나타내고 있습니다. 원익큐브는... 정치인 테마주에 대한 감시를 강화해 불공정 매매행위를 잡아 내겠다고 공언하고 있지만... ,20210311
박특검과 윤석열 전 검찰총장과는 특별한 인연이 있는데 대검찰청 중앙수사부에서 중수붕장과... 주가에 휩쓸리지 말아야 합니다 투자에 참고하세요 #원익큐브 #<b>윤석열테마주</b> #정치인테마주 #대선후보지지도,20210319
이에 따른 윤석열 관련 테마주들이 급등하는 모습들을 보였었습니다. 그중에서 대표적인 3가지를... 유재만이 윤석열 전총장과의 서울대 동문이기에 <b>윤석열 테마주</b>로 뽑히고 있어요. 덕성 다수의 기업과의... ,20210315
"오늘 <b>윤석열 테마주</b>를 두고 감히 떠오른 말은 &quot; 영원한 대장도, 영원한 쫄병도 없다&quot; 일반적인 테마주를... #테마주 #<b>윤석열</b> #<b>테마주</b> #코스피 #코스닥 #대선테마 #대선주 #석열 #대장주 #테마정리 #210310 #정치... ",20210310
"[특징주]윤석열 검찰총장직 사의 표명…'<b>윤석열 테마주</b>' 급등 등록 2021-03-04 오후 2:36:17 수정 2021-03... 이들은 사외이사, 대표이사 등이 윤 총장과 서울대학교 법대 동문이라는 이유로 테마주로 묶인... ",20210304
지지율은 즉 그 정치인의 관련주에 비례하닌깐.. 올라가라  #<b>윤석열</b> #<b>윤석열</b>관련주 #<b>테마주</b> #대선<b>테마주</b> #원익큐브 #단타 #급상승주 #주식투자 #주식종목 #주식 #주식분석,20210313
"어제 포스팅에 이어서 핫한 정치 테마주를 포스팅해볼게요! 원래는 다른 정치인의 포스팅을 할... 이유 <b>윤석열 테마주</b>와 뉴스 윤석열 지지율, 양자대결서 이낙연·이재명 다 이겼다 (2021.01.19 오후 4시)... ",20210119
"굳이 공시로 윤석열과 관련없다고 해서 폭락한 덕성과 NE능률을 버리고, (어제 벌고 오늘 잃고 본전-_-;) 새로운 <b>윤석열 테마주</b> 발굴해야겠습니다. 서로 자기 종목이 테마주라고 우기는데 일단 웅진 이트론은 좀... ",20210309
"아무리 <b>테마주</b>가 간다지만, 정말 밑도 끝도 없는 같은 성씨라서 가는 건 또 첨 보네요 웅진(016880)이 대권 주자로 급부상한 <b>윤석열</b> 전 검찰총장 관련주로 엮이면서 장중 상한가를 기록했다. 윤석금... ",20210308
"가깝고도 먼 대선테마주 주식을 처음 시작할때, 정치 테마주를 하면 수익률이 좋다라는 친구의 말을... 강세일때부터 <b>윤석열 테마주</b>까지 엮여서 좋은 모습을 보이고 있다. 그래서 푸른저축은행은 몇일은 더... ",20210311
ㅋㅋㅋ) 3월 10일도 뚜렷한 주도 섹터 보다 다시 한번 정치<b>테마주</b>가 이끄는 장세를 보여 준 것 같습니다. 2021년 3월 9일 화요일 상한가 TOP 30 주식뉴스 1. 아이크래프트(052460) (29.99%): <b>윤석열</b> 전... ,20210311
<b>윤석열 테마주</b> 누가 대장인거냐? NE능률이 3월 4일부터 8일까지 3연상을 쳤다. 솔직히 3상뒤면 전형적인... #테마주#윤석열#윤석열테마#대선테마#투표#코스피#코스닥#대장주#테마분석#동방#쿠팡#테마그룹... ,20210310
https://blog.naver.com/nanacheri10/222264646857 어제 정치 테마주에 대한 포스팅을 했는데 오늘 대장이... 이번주도 수고많으셨습니다 ^^ #ne능률 #서연탑메탈 #윤석열 #<b>윤석열테마주</b> #매매일지,20210305
"윤석열 검찰총장이 사의했다. 정치는 경제와 쌍둥이다. 정치 이슈가 터지면 가장 민감하게 움직이는 게 증시다. <b>윤석열 테마주</b>라고 불리는 기업들 주가가 상한가를 쳤다. 서연탑메탈, 덕성, 서연, 덕성우. 총 네... ",20210304
"NE능률, 덕성, 서연, 극동유화, 성보화학 주가 / <b>윤석열 테마주</b> 정리 안녕하세요 ! 오토핫키 한정훈... 성보화학이 윤석열 전 검찰총장 테마주로 묶이게 되면서 지난주 10일 상한가를 기록하였는데요. 성보화학의... ",20210317
윤씨라고 <b>윤석열 테마주</b>라고 떠들어대고 있었어요. 일단 파평 윤씨 테마주는 맞았어요. 코스피 003460... &quot;이건 정말 파평 윤씨 테마주 인정이다.&quot; 보고 웃었어요. 윤경립 대표이사 회장과 윤석열 전... ,20210311
"아무리 요즘 금리인상 이슈, 인플레이션 이슈 때문에 은행주가 주목받는다고 해도 제2금융권 은행주 저축은행 <b>테마주</b> 코스닥 007330 푸른저축은행 주식이 15.72%나 폭등할 리는 없었어요. 은행주가... ",20210309
및 테마주 정리와 분석 <b>윤석열 테마주</b>에 주목해야 하는 이유 1. 현 문재인 정부와의 갈등 문재인 정부와 윤석열 검찰총장과의 갈등이 계속해서 고조되면서 윤석열 관련주에 대한 관심이 뜨겁습니다.... ,20200803
여기에서는 코스닥 153490 우리이앤엘 주식이 <b>윤석열 테마주</b>다 이낙연 테마주다 싸우고 있었어요. '이건 조금 더 찾아봐야겠다.' 코스닥 153490 우리이앤엘 주식이 어떤 테마주에 속하는지 더 찾아보기로... ,20210308
'코스닥 181340 이즈미디어 주식은 무슨 테마주지?' 코스닥 181340 이즈미디어 주식이 또 어떤 테마주에 속하는지 알아봤어요. <b>윤석열 테마주</b>! 코스닥 181340 이즈미디어 주식은 윤석열 검찰총장 인맥주로... ,20210115
"11 윤석열 관련주, <b>윤석열 테마주</b>, 정치 테마주 (0) 2020.11.11 2020.11.10 주식 이슈, 뉴스 상승 종목 (화이자 관련주, 모더나 관련주, 백신 관련주) (0) 2020.11.11 MSCI 지수 편입 종목(2020년 11월) 스몰캡 포함 (0)... ",20201111
윤석열 전 검찰총장 사퇴로 급 차기 대권주자로 올라가면서 정치테마주 탐 심지어 대권 지지율 1위 등극 금일 오전 11시 기준으로 코스피 코스닥 상승율 종목에 <b>윤석열 테마주</b>가 대체 몇개람.. 덕성 덕성우... ,20210308
윤석열 관련주 테마주 대장주 서연 <b>윤석열 테마주</b> 관련주로 부각되고 있는 서연 은 코스피 종목으로써 시가총액이 약 2500억원대 입니다. 작년 2분기까지 적자였으나 3분기에 250억원의 영업흑자를 기록하면서... ,20210308
코스닥 033830 티비씨 주식 관련해서 <b>윤석열 테마주</b>는 대구 경북 보수 인사 정치 테마주라는 틀에서는 벗어나 있지만 보수 쪽에서 윤석열을 크게 지지하다보니 배병일 티비씨 사외이사가 윤석열씨가... ,20210313
"<b>윤석열 테마주</b> 기업 실적 및 기업 개요를 알아보도록 하겠습니다. <b>윤석열 테마주</b>는 서연,덕성,모베이스,모베이스전자,아이크래프트,서연이화,대영포장,ne능률,태양금속 등이 있습니다. 아래에서 자세하게... ",20210313
"치료제, <b>윤석열테마주</b>) 화이자 및 모더나 등의 코로나19 백신 개발 기대감에 초저온 백신 유통 수혜... 만도 윤석열 검찰총장의 대권주자 지지율 첫 1위 소식 등으로 정치/인맥(윤석열) 테마 상승 덕성... ",20201112
"귀찮음) #<b>윤석열테마주</b> #윤석열관련주 #대선관련주 #정치테마주 #하지마! 지니뮤직 장중 상한가, 텐센트 협업설 단독 기사 &gt; KT 사실무근... 어? 이거 어디서 본듯한데...? https://sootabucks.tistory.com/3490... ",20210305
"이번 글에서 검찰총장 사퇴 이후 정치테마주로 이슈가 되어 관련 주식 종목에 영향을 미치고 있는 '<b>윤석열 테마주</b>'와 연관성에 대해서 정리해보겠습니다. 서연(007860) - 코스피, 자동차 부품 (업종... ",20210308
"윤씨) [테마주 &amp; 수혜주] - <b>윤석열 테마주</b>(윤석열 관련주, 인맥주) 정리 2021.03.08 코스닥 상한가 [동국알앤에스](075970) 마산과 김해 및 해외현지법인에서 연간 78천톤 규모의 생산시설을 보유하고 제강용... ",20210308
대선출마 유력?feat.테마주 상한가 윤석열 검찰총장이 기어코 검찰총장직을 사퇴하고 말았다. 4일 서울... 전반적으로 하락세를 보였던 주식시장은 윤석열 검찰총장직 사퇴와 정계진출 분위기로 <b>윤석열 테마주</b>... ,20210305
