text,created_at
"이재명 테마주 동신건설, 에이텍, 에이텍티앤 ★ 이낙연 관련주, <b>이낙연 테마주</b> 남선알미늄, 이월드, 서원 미국 대통령 1순위 바이든 &quot;주주 자본주의 끝내겠다&quot; - 미국주식 sootabucks.tistory.com/2746 미국... ",20200711
"유니슨 주가 전망 풍력, <b>이낙연</b> 정치 <b>테마주</b> 48조 친환경 에너지 관련주 유니스 주가전망 일전에 유니슨 주가 전망을 한번 했습니다. 2021/01/07 - [주식/초보주식] - 2021년 유니슨 주가 전망 (신재생 에너지... ",20210209
반응형 <b>이낙연 테마주</b>로 알려진 국내 알루미늄 전문기업 남선알미늄이 급등세를 보이고 있는 가운데... 알려지며 이낙연 정치테마주로 분류됐습니다. 하지만 이계연씨는 1년 반 동안 삼환기업 대표를... ,20191218
이월드의 박성수회장은 이낙연 총리와 광주제일고 동문으로 알려져있는데 <b>이낙연 테마주</b>로 엮이게 되었습니다. 테마주는 실적과는 관계없이 움직이는 종목으로 가치투자를 하시는 분들은... ,20191119
삼부토건이 이낙연 더불어민주당 대표의 동생 이계연 씨를 경영진으로 영입하면서 급부상하고 있는 가운데 '<b>이낙연 테마주</b>'로 거론되던 남선알미늄과 온도 차를 보이고 있다. 삼부토건은 지난 22일 공시를... ,20201025
"그럼 <b>이낙연 테마주</b>에는 어떤 기업들이 있는지 알려드리고, 그에 대한 제 생각을 말씀드리겠습니다.... 그밖에 정치 테마주로 불리는 기업들은 대부분 대표이사들이 이낙연 전 총리와 동문설로 이슈에 오른... ",20200209
"이미 늦었겠지만, 이낙연 관련주(<b>이낙연 테마주</b>)를 정리해 보고자 합니다. 남선알미늄 이낙연 동생 이계연 SM그룹 계열사 삼환기업 대표이사로 같은 그룹 계열사란 점 부각 티케이케미칼 이낙연 동생 이계연... ",20181206
이런 테마주는 놓치기 아까운 매력적인 종목들이긴 합니다. 투자에 주의 해야 한다는 말씀을 거듭 드리면서 10가지 종목 을 알아보도록 하겠습니다. #이낙연관련주#<b>이낙연테마주</b> 10가지 정리 #남선알미늄... ,20200205
남선알미늄은 이낙연 후보의 친동생이 계열사에 근무했다는 사실이 알려지면서 <b>이낙연 테마주</b>로... #정치테마주 #남선알미늄 #총선테마주 #종로출마 #이낙연 #황교안 #대선주자 #415총선,20200406
"이낙연 전 총리의 동생이 남산알미늄 대표이사가 되면서, 남선알미늄은 일약 정치 테마주... <b>이낙연 테마주</b>라는게 중요하다. 반대로 한창제지 종목은 황교안 테마주로 분류되고 있다. 한창제지... ",20200406
"사외이사와 이낙연 전 총리의 친분으로 테마주로 분류 되고 있습니다. PC 본체, 모니터 등 다양한 PC 용품을 생산하는 회사입니다. 이상 <b>이낙연 테마주</b> 관련주 수혜주 10가지를 정리해 보았습니다... ",20200308
1972년생인 김세연 미래통합당(부산 금정구) 의원과 함께 대표적인 40대 기수론 후보로 꼽힌다. 한편 <b>이낙연</b> 전 총리 <b>테마주</b>로 꼽히는 남선알미늄은 전일 대비 1.88%(85원) 오른 4595원에 거래되고 있다.,20200427
