text,created_at
"<b>이재명</b> 도지사의 고향인 안동에 위치하고 있어 <b>관련주</b>로 분류가 되는 것 같음. 주가가 엄청 올랐다가 12월 24일에 급락을 했다고 함.. 5) 오리엔트바이오 '실험동물의 생산, 수출, 수입 및 생명과학 <b>관련</b>... ",20210131
"<b>이재명 관련주</b> - 차기 대선 후보 정치 테마주 대선이 1년이 채 안 남은 지금, 선거판이 요동치고... 있는 이재명 경기도 지사와 관련된 관련주를 살펴보도록 하겠습니다. * 주의! 정치테마주 투자는 조심하여... ",20210307
오늘은 몇 일전 재판 생중계까지 이어진 이재명 경기도지사 관련주에 대해서 알아보고 대장주로서... 미국도 마찬가지로 조 바이든 관련주가 있듯이 우리나라에도 <b>이재명 관련주</b>가 있습니다. 이렇게 4월... ,20200721
오늘은 정치테마주 중에 대선 관련주를 모아 정리해봤다. &lt;이낙연 관련주&gt; 여권 대권주자로서 큰... 고려시멘트 &lt;<b>이재명 관련주</b>&gt; 근래에 경기도민에게 10만원씩 2차 재난지원금을 지급할거라 공표하였다 에이텍... ,20210208
인터지스 인터지스는 이재명 지사와 사법연수원 동기라는 점이 관련주로 편입을 하게 했는데 차트가 그렇게 좋아보이지는 않ㅅ흡니다 물론 장중 시세는 많이 줬습니다. 오늘 <b>이재명 관련주</b>는 거의 대부분 최대... ,20200708
오늘은 평소 관심있게 보는 정치인 중 한명인 이재명 경기도지사와 관련된 테마주들이 있다고 해서... 인사가 이재명 경기도지사거든요 ㅋㅋ 암튼 오늘 포스팅할 <b>이재명 관련주</b>를 조사하다보니 회사의... ,20210311
윤석열 관련주 포스팅을 했는데요. 오늘은 이어서 강력한 라이벌로 꼽히는 <b>이재명 관련주</b> 정리해봤습니다:) 어제 9일 여론조사 엠브레인퍼블릭에서 발표한 설문조사로는 이재명 지사가 윤석열 전... ,20210310
무상교복이라는 정책과 맞물려 이재명 도지사가 성남시장 시절부터 관심 받는 <b>이재명 관련주</b> 기업으로... 사업적 관련성은 없다고 밝혔습니다. 4. 토탈소프트 대표이사 최장수씨가 이재명도지사와 중앙대... ,20201216
개미 동지 여러분 어서오시고~~ 요새 이재명 경기도지사가 대선주자중 여론조사 1위를 달리고 있지... 소개할 <b>이재명 관련주</b>도 마찬가지지만 정치 테마주라는게 참 어처구니없는 것들을 끼워 맞춰다가 관련주라... ,20210303
"오늘은 공부할겸 가지고 온 #<b>이재명관련주</b> 즉 완전 테마주관련 내용을 가지고 와봤다 쫄보이면서 잘... 같은 관련주들은 이재명 경기지사가 사람들에게 어떤 반응을 얻어내고, 그가 어떤 행동을 하냐에따라... ",20210208
금일 쿠팡 관련주들이 상한가를 많이 갔는데 이스타코는 <b>이재명 관련주</b>(장기공공주택뉴스)로... 동사의 주 업종은 부동산매매업으로 중소기업기본법 시행령 제3조 1호에서 부동산업 및 임대업종으로... ,20210217
"<b>이재명 관련주</b> 정리_ 오리엔트바이오, 에이텍, 형지엘리트, 동신건설, 주가 전망 안녕하세요. 쉽게... 사업적 관련성은 없다고 공시한 바 있습니다. 관련주 2 # 동신건설 이재명 지사의 고향에 있다는 이유로... ",20210310
SG&amp;G 유시민 관련주에서 최근 <b>이재명 관련주</b>로 체인지 SG충방 이하동문 동신건설 지엘팜텍 형지I&amp;C 이재명이 무상교복에 대한 언급 때문에 형제 시리즈가 <b>이재명 관련주</b>로 엮였죠. 형지엘리트 이하동문 하츠... ,20210114
이재명 신년토론 출연.. 각종여론조사 1위..당연히 관련주식들이 요동을 치는데요 오늘은 한번 <b>이재명관련주</b>를 스터디해봅니다. 어느 주를 사야할까요? 귀신도 모른답니다. 하지만 분명..당선 가능성만 더... ,20210105
안녕하세요 차기 대통령 선호도에서 <b>이재명</b> 경기도지사가 더불어민주당 이낙연 대표와 윤석열 검찰총장에 모두 두 배 이상 격차로 앞선다는 여론조사 결과가 13일 나왔는데 <b>이재명</b> 경기지사의 상승세가... ,20210214
"<b>이재명 관련주</b> : 동신건설, 형지엘리트 동신건설은 회사 본사가 이재명 경기도지사의 고향인 경북 안동에 위치하고 있어서 그런 관련성으로 관련주로 부각되었습니다. 재판 3일전부터 급상승하기 시작한 주가가... ",20200817
요즘 시장에서 가장 관심을 받는 종목은 <b>이재명 관련주</b>인듯합니다. 물론 대형주의 주가도 좋지만... 많은데 관련주가 아니라는 뉴스가 나오면 주가가 요동을 치기도 합니다. 글로벌에스엠도 이재명과 관련이... ,20210119
"이낙연 이재명 본인 뿐만 아니라 그들과 관련 된 사람들의 소식에 따라 주가가 철렁이고, 뉴스에 뜨기도 함. 저번 포스팅에선 이낙연 관련주를 살펴봤으니 오늘은 <b>이재명 관련주</b>를 살펴보자. 이재명... ",20201022
"수산아이앤티는 보안관련 솔루션을 개발 및 공급하는 IT회사 입니다. 정치 관련주에 관심이 많으신분들은 당연히 아시겠지만, 수산아이앤티는 대표적인 <b>이재명 관련주</b> 라고 알려진 회사 입니다. 오늘의... ",20210312
출처 : 문화뉴스(http://www.mhns.co.kr) 이미 윤석열 전 검찰총장 관련주는 한차례 폭등을 보여주었죠?... 부동산 관련 <b>이재명 관련주</b>로 분류된다. ▣ 성안 011300 박상완 부사장이 이재명 지사 동문으로. 이재명... ,20210309
오늘은 <b>이재명 관련주</b>에 대해 분석할게요 먼저 이재명 지사님의 프로필부터 볼게요 현재 경기도... html 그럼 <b>이재명 관련주</b>에 대해 알아볼게요 (최근 관련주가 급등한 경우가 많으니 투자에 주의 각별... ,20210301
경제관련 코멘트를 항상 체크하고 있어야 합니다. 정치 관련주는 5년에 한번씩 시장에서 가장 큰... 있는 이재명 경기도지사 관련주를 알아봅시다. [ <b>이재명 관련주</b> ] 동신건설 수산아이앤티 에이텍... ,20210310
이재명에 관해 부정적일수 있습니다.지지자는 조용히 닫기를 해주세요 2021년 2월 2일 기준 이재명이가... 파급력도 좋고요 동신건설은 이 지사의 고향인 경북 안동에 본사가 있다는 이유로 <b>이재명 관련주</b>로... ,20210202
"전국 도급 순위 300위의 기업으로서 주 원료는 목재, 철근, 시멘트 등 입니다. 본사가 이재명... 때문에 이재명의 정책과 관련하여 <b>이재명 관련주</b> 로 묶이고 있습니다. 이상으로 <b>이재명 관련주</b> 에 대해서... ",20210115
- <b>이재명 관련주</b>로 분류된 이유 : 무상교복과 관련된 회사이며 이재명이 경기도를 중심으로 무상교복... 성남시장이었던 이재명 지사여서 관련주로 불리고 있다. [현재까지 <b>이재명 관련주</b>로 언급되는 종목]... ,20210310
"무엇보다 무상교복이라는 정책과 맞물려 이재명 도지사가 성남시장 시절 관심 받는 <b>이재명 관련주</b>라 분류되고 있는 중이기도 합니다. 세 번째, 동신건설입니다. 국내 토목과 건설업을 영위하고 있는... ",20210106
"<b>이재명</b> 지사와 중앙대 동문 슈프리마에이치큐 서버 및 스토리지 시스템 구축, 제조 등 IT <b>관련</b> 제조, 유통 대표이사가 성남창조 경영 CEO 포럼 부의장이었고 당시 의장이 성남시장이었던 이 지사여서 <b>관련주</b>... ",20210310
"개인적인 생각에 가능성이 높아보이는 이낙연 및 이재명 관련 기업을 알아볼게요. 참고로 말도 안되는... <b>이재명 관련주</b>는? 에이텍, 에이텍티엔, 형지엘리트, 동신건설, 오리엔트바이오, 토탈소프트 등 역시... ",20201221
돌아올 수 있어 주의해야 합니다 투자에 참고하세요 #<b>이재명관련주</b> #정치인테마주 #이재명경기도지사 #대선테마주 #신라에스지 #수산아이앤티 #토탈소프트 #형지엘리트 #에이텍 #동신건설 #성안 #비비안,20210127
급상승테마에는 <b>이재명 관련주</b>가 2위로 올라섰습니다. 그럼 이재명 테마 관련주는 무엇이 있는지... 7월 (주)에이텍(존속법인)의 교통카드 솔루션 사업 부문이 인적분할되어 설립되었습니다. 에이텍과... ,20201209
"동신건설 <b>이재명</b> 도지사 고향인 안동에 소재 출처: 전자공시다트 주로 관급 공사를 다수 해왔으며 건축, 토목 등 건설<b>관련</b>한 사업을 영위하는 기업입니다 출처: 전자공시다트 9월말기준 유통주식수를 보면... ",20201225
<b>이재명 관련주</b>로 주목을 받게 되는 부분은 바로 이재명 현경기도지사가 이전에 해당 기업에 근무를 했다는점에서 주목을 할 수 있는 요소로 손꼽아볼 수 있습니다. 기본적으로 정치와 관련된 주가들의... ,20201229
<b>관련주</b>로 시장에서 부각되며 급등 자안(221610) : MP한강 지분 양수 결정에 따른 최대주주 등극 예정에 급등 에이텍티앤(224110) : 대통령 선거 후보별 당선 가능성 예측 조사 1위 소식에 정치/인맥(<b>이재명</b>)... ,20210309
<b>이재명 관련주</b># 윤석열 관련주# 이낙연 관련주# 차기대선 관련주# 이재명 지지율# 윤석열 전 총장이... 사업적으로는 이재명 경기도 지사와 아무런 관련이 없습니다. 정치인 테마주답게 인맥에서 비롯된 관련주... ,20210311
"<b>이재명 관련주</b> 이재명 지사를 옥죄고 있던 사안에 대해서 최종 판결이 나오므로써 이낙연 지사의... 친환경 관련 테마들이 있는데, 친환경은 글로벌 테마이기 때문에 이낙연 관련주는 아닐 걸로 생각해서... ",20201017
"이재명과 관련성은? (<b>이재명 관련주</b>) 오리엔트바이오는 한때 이재명이 오리엔트정공에서 일을 했던... 관련성이 없다고 공시한 바 있습니다. 주주 및 지분구조는? 주주 및 지분구조를 확인해보면, (주)... ",20210309
관련 종목들이 최근 거래량이 들어오면서 반등 나왔고 앞으로도 추가 상승이 기대 되며 하락장에서도... 점에 수혜를 받고 있습니다. #이재명 #엠라이브 #MLIVE #<b>이재명관련주</b> #이재명테마 #대선주 #대선관련주,20210312
"VS 이재명 지지율 싸움이 상당할 것이고 그것을 기대하며 <b>이재명 관련주</b>를 알아보자! 1.에이텍... 동신건설: 건설주, 본사 안동에 위치, 이재명 고향 안동 4.수산아이엔티: sw관련주, 임원 18년... ",20210308
"<b>이재명 관련주</b> 에이텍, 토탈소프트, 프리엠스, 비비안 에이텍티엔, 동신건설, 형지엘리트는 전... 매매하시는게 좋지 않을까 싶네요. <b>이재명 관련주</b>로 에이텍, 토탈소프트, 프리엠스, 비비안을 알아봤습니다. ^^",20210104
어제 이재명 경기도지사의 대법원 선고가 있던 날이었어요! 친형 강제입원 관련 허위사실 유포에 대한... 회장과 이재명 경기도지사가 중앙대 동문이라서 <b>이재명 관련주</b>라고 하네요. 동문이라서 관련주?!... ,20200717
"#<b>이재명관련주</b> 이재명 경기도지사가 기본소득과 기본주택, 기본대출 등 경제기본권 확보를 통한... 맞물려 이재명 도지사가 성남시장 시절 관심을 받던 종목이라 관련주로 분류되고 있습니다 #동신건설 국내... ",20210119
내 줄 것이 아니라 공공이 보유하되 국민들이 평생 편히 살도록 기본주택 으로 공급해야 한다&quot;고 발표했는데요 장기공공주택 정책 <b>관련</b> <b>이재명</b> 경기도 지사와 연관이 있다며 <b>관련주</b>로 묶였습니다. <b>이재명</b>... ,20210304
"&lt;희토류 관련주-동국알엔애스,유니온&gt; 동국알앤에스,유니온 오전장 동시 공략후 각각 3%내외,5%내외... (최근 평균 변동성(ATR)은 급등시 15%슈팅을 줄수있는 종목-실제로 14%까지 장중 슈팅을 줌) &lt;<b>이재명 관련주</b>... ",20210319
안녕하세요 이재명 경기도지사가 대선주자 여론조사에서 1위를 차지했다는 소식에 관련주인... 사업적 관련성은 없다&quot;고 공시한 바 있습니다. 이재명 지사와 관계가 부각되면서 <b>이재명 관련주</b>로 알려지고... ,20210115
일부 관련주 상승 #오성첨단소재 #마이더스AI 7. <b>이재명 관련주</b> 대통령 선거 후보 별 당선... 정치/인맥(이재명) 테마 상승 속 급등 #성안 (011300) : 대통령 선거 후보별 당선 가능성 예측 조사... ,20210309
"안녕하세요 레트로마니아 입니다 요즘 대선 관련주들이 많은 움직임을 보이고 있죠 그중에 가장 핫하디 핫한게 바로 <b>이재명 관련주</b> 와 윤석열 관련주가 가장 핫할텐데요, 오늘은 이재명씨 관련된 주력 주를... ",20210320
"지사의 관련주들에는 어떠한 종목들이 있는지 한 번 찾아보도록 하겠어요.. 이낙연 - 이재명 - 윤석렬 <b>이재명 관련주</b> ? 정다운은 2009년에 설립된 기업인데요, 오리를 손수 사육하고 도축한 다음 가공해서... ",20210118
알고 계신 관련주가 있으시면 댓글을 남겨주시기 바랍니다. 출처 : NEWSIS <b>이재명 관련주</b>(테마주) 비비안 - 이재명 혜경궁김씨 사건 대법원 무죄 판결 변호사 이태형 변호사가 비비안 사외이사로... ,20210319
"현재 오리엔트바이오는 실험동물 생산 수출, 수입과 생명과학 관련 연구개발업을 주된 영업목적으로... 오리엔트바이오가 <b>이재명 관련주</b>로 분류된 이유는이재명 지사가 11세에서 17세 까지 소년노동자로... ",20210304
다 <b>이재명 관련주</b>이더군요. 요즘 시장에서 꽤나 핫한 테마주가 <b>이재명 관련주</b>인 것 같습니다. 현재... ㅋㅋ 출처: 뉴스웨이 보시다시피 6개를 제외하고 나머지는 전부 회사 대표가 이재명과 학연이나 지연으로... ,20210121
<b>이재명 관련주</b> 대선후보 정치 테마주 이유 안녕하세요. 노마드대첩 입니다. 차기 대선이 1년도 안 남은... 오늘은 차기대선 후보 1위로 주목받고 있는 이재명 도시자 관련 종목들에 대해 알아볼께요. 이재명... ,20210308
"<b>이재명 관련주</b> - 자고 일어나면 <b>이재명 관련주</b>가 새로 생기네요.. 이건 뭐 정리하기에는 너무 많네요.... 지역화폐 관련주인데 엮일일이 없을까요? 한국팩키지, 형지엘리트, 형지i&amp;c, 아즈텍 w.b -&gt; 무상 급식... ",20210124
이스타코는 지난 10일 장기공공 주택 정책에 관련해 이재명 경기도지사와 연관이 있다며 관련주에... 전망 <b>이재명 관련주</b> 언급되며 강세 이스타코 주가가 폭등했다. 10일 오전 11시 35분 기준 이스타코는... ,20210310
시간외상승 &lt;<b>이재명 관련주</b>&gt; 에이텍티앤 (224110) (+16.90%) 2021 03-04 3월 1주차 대선후보 적합도... 정치/인맥(이재명) 테마 상승 속 급등 &lt;윤석열 관련주&gt; 모베이스전자 (012860) (+16.78%) 2021 03-04... ,20210305
고등학교 동문) #서원 (사외이사가 이낙연 전 총리와 대학교 동문) #남선알미늄 (이낙연 전 총리의 동생이 계열사인 삼환기업의 고문) #<b>이재명관련주</b> #이재명테마주 #이낙연관련주 #이낙연테마주 #대선테마주,20200729
"<b>이재명 관련주</b> 에이텍, 에이텍티앤, 티엘아이 - 신승영 대표 성남창조경영 최고경영자(CEO) 포럼 운영위원직 동신건설 - 고향 대표 회사로 관련 정다운, 토탈소프트, 지엘팜텍, 보라티알, 수산이엔티, 카스... ",20210310
특혜와 관련된다면 권력형 부정부패로 형사처벌을 받게 될 겁니다 투자에 참고하세요 이재명 테마주 에이텍 에이텍티앤 토탈소프트 동신건설 형지엘리트 형지I&amp;C 비비안 정다운 티피씨글로벌 #<b>이재명관련주</b>... ,20210113
"안철수 관련주 - 안랩, 써니전자, 꺄뮤이앤씨 등 <b>이재명 관련주</b> - 에이텍, 에이텍티엔, 동신건설 등... 지난 주 서울시장 후보에 나오겠다는 박영선 관련주들이 핫하더니, 오늘은 안철수 관련주들이 핫합니다.... ",20201221
"해당 관련주에 관심이 쏟아지고 있습니다. 현재 이재명 경기도지사는 이낙연 전 총리와 강력한 대권... 지난 7월 이재명 도지사와 관련한 대법원의 판결 영향에 따라, 오래전부터 <b>이재명 관련주</b>로 분류되었던... ",20200813
얼마전 지지율 조사결과가 이재명이 1위 윤석열이 2위 그리고 큰 차이로 이낙연이 3위를 차지했다는... 살아있는 <b>이재명 관련주</b>를 살펴보겠습니다. 최근에 갑자기 툭 튀어나와서 관련주라고 하는 것들이 너무... ,20210115
전일 이재명 지사의 지지율이 1위를 기록했다는 소식에 <b>이재명 관련주</b>로 꼽히는 나노스에 매수세가... 투자자들이 학습효과가 되어 있어 대선주자와 관련이 있는 것은 무엇이든 이유를 대고 묻지마 투기에... ,20210127
수산아이앤티는 <b>이재명 관련주</b>로 편입되면서 개인투자자들의 묻지마 투기가 유입되고 있습니다. 이에 대해 정은아 수산아이앤티 전무는 “이재명 경기도지사와 당사의 경우 과거 및 현재 사업적 관련성이... ,20200812
"<b>이재명 관련주</b> 오리엔트 바이오, 오리엔트 정공 오리엔트바이오- 이재명이 한때 시계공장에서 일함. 2017년엔 오리엔트바이오 공장에서 대선 출마 기자 회견도 함 8월달에 <b>이재명 관련주</b>로 크게 슈팅이... ",20210104
오늘 기업분석할 기업은 <b>이재명</b>테마 <b>관련주</b>로 분류되어 있는 코이즈입니다. 오늘 20.61%의 상승을 보여줬습니다. 동사는 LCD의 부품인 백라이트유닛(BLU)의 핵심소재인 광학필름의 코팅과 도광판 및 보호필름... ,20210205
<b>이재명 관련주</b>는? 안녕하세요! 요즘 점점 수급이 들어오고 있는 대선 테마 중 최근 지지율이 치솟는 이재명 경기도지사 관련주에 대해 정리해보겠습니다. 벌써 대선 테마? 사실 대선 테마는 5년마다 한 번씩... ,20200709
"■ 개별주 한화 : '우주산업 강화' 행보…한화시스템 강세 KTH : 쿠팡 관련주, 3일 연속 강세 대영포장... 비비안 : 이재명 지지율 1위 소식에 상한가, ㄳㄳ SG&amp;G : <b>이재명 관련주</b>, 단기과열 토탈소프트 : 상동... ",20210113
"<b>이재명 관련주</b>를 알아보았다. 에이텍을 대장주로 에이텍티앤, 동신건설 모두 성삼시와 안동시... 토목 관련주 소재지 안동, 이재명 고향이 안동 실적은 그다지 좋다고 볼 수 없음 [챠트] 2020년 12월 큰 상승... ",20210304
"인수추진설 <b>관련</b> 사실무근 소식에도 불구하고 이틀째 급등 KCTC(009070) : 쿠팡, 이르면 11일 美 상장 예정 모멘텀 지속에 쿠팡 <b>관련주</b> 상승 속 급등 에이텍티앤(224110) : 3월 1주차 대선후보 적합도, <b>이재명</b>... ",20210304
"에이텍 에이텍티앤 형지I&amp;C 무상교복 형지엘리트 무상교복 코맥스 수술실 CCTV 관련 코콤 수술실 CCTV 관련 대장주 에이텍, 에이텍티엔을 필두로 무상교복 관련주, 수술실 CCTV 관련주 이정도를 <b>이재명 관련주</b>로... ",20201214
상한가 &lt;<b>이재명 관련주</b>&gt; 에이텍티앤 (224110) (+14.89%) 2021 03-09 대통령 선거 후보별 당선 가능성 예측 조사 1위 소식에 정치/인맥(이재명) 테마 상승 속 급등 성안 (011300) (+13.90%) 2021 03-09 대통령 선거... ,20210310
아프리카돼지열병 조류독감 구제역 이버멕틴 동물용의약품 <b>이재명 관련주</b>식 대성미생물의 주가... 동물용의약품 이재명 등등 여러가지 관련주로 평가되고 있구요. 2021년 3월 12일 장후 시가총액은... ,20210319
"<b>이재명 관련주</b>로는 형지엘리트, 오리엔트바이오, 오리엔트정공, 동신건설, 에이텍, 토탈소프트, 수산아이앤티 등등 너무도 많죠. 최근 이재명 지사 관련주가 계속해서 상승세인 이유는 여권에서 이낙연... ",20210116
"2021/01/21 목요일 특징주 &lt; 개인적인 정리 / 질문사절 &gt; ■ 시장 이슈 바이든 취임 / 트럼프 퇴임 우주항공 <b>관련주</b> / 정치테마(<b>이재명</b>) / 자율주행(애플카) <b>관련주</b> 강세 ■ 개별주 엔비티 : 금일 신규상장, 공모가... ",20210121
일확천금을 노리면 될일도 안됩니다~~ 이상 주린이 송소장이었습니다^^ #지역화폐테마주 #지역화폐관련주 #이재명테마주 #<b>이재명관련주</b> #재난지원금관련주 #재난지원금테마주 #코로나지원금관련주... ,20210121
"한네트, 한국전자금융, 푸른기술 - 이지사가 과거 화폐개혁 <b>관련</b> 기사 공유 11. 국제약품 - 김선평 사외이사가 <b>이재명</b> 지사의 사법연수원 선배 12. 아즈텍WB - 무상교복 정책 <b>관련주</b> 13. 하츠 - 벽산그룹... ",20210117
"성안 <b>이재명 관련주</b>? 출처, 이재명 인스타그램 박상원 부사장은 이재명 지사와 중앙대 동문으로 알려지면서 주가는 300원대에서 1000원까지 오르기도 하였습니다. 성안 2020년 재무제표 회계감사 조만간 3월... ",20210304
성안 <b>이재명 관련주</b> 편입 이후의 상황들인데요. 대구에서는 중견 섬유기업으로 알려져있는 회사인데... 2021년 접어들면서 이재명 테마주 소식으로 엄청난 상승세를 보였습니다. 하지만 최대악재 발생으로... ,20210306
오리들 AI확진 기사가 있어서 그거 때문인가 했더니 <b>이재명 관련주</b>라고 한다. 이유가 정말 어이없는데 그렇다. 안철수 서울시장 나온다고 발표한 다음 월요일 관련주들 마구 오르고 그랬는데 [까뮤이앤씨... ,20210106
"소개해드릴 관련주! <b>이재명 관련주</b> 입니다. 지지율이 가장 높은 이재명 경기도지사의 관련된 기업을 알아보겠습니다 에이텍 에이텍 <b>이재명 관련주</b>의 대장주라고들 합니다 LCD디스플레이 응용제품을 제조 , 생산... ",20210309
"관련주, <b>이재명 관련주</b>, 박영선 관련주등을 포스팅 했네요. 이젠 나올만큼 나온 것 같은데... 정세균 관련주나 나중에 포스팅 하겠습니다. 동신건설 에이텍티앤 형지엘리트 동신건설 이재명 고향에... ",20201221
"물론, 이보다 더 중요한 것은 대표이사 최장수씨가 이재명 도지사와 중앙대학교 동문이라는 점으로, 이 때문에 <b>이재명 관련주</b> 로 주목받고 있다는 점입니다. 네 번째, 형지엘리트 입니다. 엘리트 교복브랜드로... ",20201218
"[특징주]이스타코 주가, <b>이재명 관련주</b> 언급되며 강세 대선 관련주에는 크게 인맥주 정책주 두가지로 나뉘는 성향이있다. 이재명지사의 경우 인맥주들의 시세가 어느정도 부담이 되는 상황이라 정책에 관련되서... ",20210310
"찬성을 한 '경기도 이재명 지사' <b>이재명 관련주</b>를 찾아보자!! 동신건설, 프리엠스, 에이텍티앤, 에이텍, 수산아이앤티, 형지I&amp;C, 형지엘리트, 인터지스, 토탈소프트, 보라티알, 오리엔트정공' 몇 개만 차트... ",20201208
"출처 : 뉴스웨이 <b>이재명 관련주</b> 캠시스, 프리엠스, 토탈포스트, 정다운, 코이즈, 성안... 안철수 관련주 안랩(053800) 박영선 관련주 iMBC(052220) 정세균 관련주 수산중공업(017550) 이낙연 관련주... ",20210201
"부각되는 관련 이슈 체크를 하기 위해 공유하는 내용이니 참고만 해 보세요. 코로나 치료제, 전기차 등... 변속기) #코로나치료제관련주 #안철수관련주 #<b>이재명관련주</b> #무상교복관련주 #신선식품관련주... ",20201221
더욱이 여전히 이재명 관련 테마주는 여전히 살아있는 재료이며 경선 결과에 따라서 얼마든지 시세를 새롭게 줄 수 있습니다. &lt;<b>이재명 관련주</b> 목록&gt; - 에이텍 - 에이텍티엔 - 동신건설 - 티엘아이 - 오리엔탈정공... ,20200721
국제약품 <b>이재명 관련주</b> 테마주 분석 <b>이재명 관련주</b>식 &amp; 이재명주 &amp; 이재명 테마주 &amp; 이재명 종목... 있습니다) 이재명 도지사 이재명 도시자의 무죄치지 파기환송으로 관련주 혹은 테마주가 강세를 보였습니다.... ,20200726
이재명 성남시장은 동상이몽에 나올 때 정말 재밌게 봤던 기억이 납니다! 은근 예능감도 있고요?ㅎㅎ 오늘은 <b>이재명 관련주</b>를 알아볼게요! 요즘 인터넷 검색하면 정말 많이 나오죠?? 다 비슷비슷합니다. 저는... ,20180226
