title,originallink,link,description,pubDate
<b>홍준표</b> &quot;윤석열 밀어내고 이재명 처리만 남아&quot;,http://news.tf.co.kr/read/ptoday/1846655.htm,https://news.naver.com/main/read.nhn?mode=LSD&mid=sec&sid1=100&oid=629&aid=0000070807,&quot;바보같이 당하지 말고 타개책 세우자&quot; 무소속 <b>홍준표</b> 의원은 6일 문재인 대통령과 정부·여당을 겨냥해 &quot;윤석열을 밀어냄으로써 야권 분열의 단초는 만들었고 이재명 처리만 남았다&quot;고 주장했다. 홍 의원은 이날 자신의... ,"Sat, 06 Mar 2021 10:33:00 +0900"
<b>홍준표</b> &quot;여배우 무상연애&quot; 이재명 저격…&quot;팩트는 총각사칭&quot; 김부선 반격?,http://news.tf.co.kr/read/national/1847405.htm,https://news.naver.com/main/read.nhn?mode=LSD&mid=sec&sid1=102&oid=629&aid=0000071442,배우 김부선이 자신과 이재명 경기지사의 스캔들을 언급한 <b>홍준표</b> 무소속 의원을 향해 &quot;사적영역을 정치로 끌어들이는 것은 옳지 않다&quot;고 말했다. 김씨는 10일 자신의 페이스북에 &quot;이재명과 저의 과거 관계는 분명히... ,"Wed, 10 Mar 2021 20:22:00 +0900"
유승민 &quot;시장경쟁&quot; 원희룡 &quot;공공+시장&quot; <b>홍준표</b> &quot;도심 초고층&quot;,http://news.mk.co.kr/newsRead.php?no=229071&year=2021,https://news.naver.com/main/read.nhn?mode=LSD&mid=sec&sid1=100&oid=009&aid=0004760923,<b>홍준표</b> 무소속 의원은 &quot;투기의 원천인 신도시 정책을 즉각 취소하라&quot;며 &quot;도심 초고층 재개발로 정책을 전환하라&quot;고 촉구했다. 홍 의원은 &quot;무분별한 땜질식 처방인 신도시 정책은 수도권의 집중 현상만 심화한다&quot;며... ,"Wed, 10 Mar 2021 13:55:00 +0900"
"<b>홍준표</b> &quot;'집값 파동' 문 정권, 투기 얼룩져…변창흠 조사 관여는 후안무치&quot;",http://mbn.mk.co.kr/pages/news/newsView.php?category=mbn00006&news_seq_no=4444564,https://news.naver.com/main/read.nhn?mode=LSD&mid=sec&sid1=100&oid=057&aid=0001556346,<b>홍준표</b> 무소속 의원이 변창흠 국토교통부 장관의 해임 요구에 가세했습니다. 10일 홍 의원은 자신의 페이스북에 올린 글에서 &quot;부동산 정책 실패로 광란의 집값 파동을 일으킨 문 정권이 그 대안으로 내놓은 신도시 정책이... ,"Wed, 10 Mar 2021 08:54:00 +0900"
"<b>홍준표</b> &quot;文, DJ 특검 넘긴 배신의 주역…이재명 방치할까?&quot;",https://news.imaeil.com/Politics/2021030712392604613,https://news.naver.com/main/read.nhn?mode=LSD&mid=sec&sid1=100&oid=088&aid=0000692001,"<b>홍준표</b> 무소속 국회의원은 문재인 정권이 여권의 대권 선두 주자로 떠오른 이재명 경기도지사를 '처리'할... <b>홍준표</b> 의원은 어제인 6일 페이스북 글을 통해 &quot;문재인 퇴임 후 안전을 위해 검찰 수사권을 해체하고, 차기 대선... ","Sun, 07 Mar 2021 12:40:00 +0900"
<b>홍준표</b> “박근혜 정부 조사로 3기 신도시 ‘물타기’…속 보이는 짓”,http://www.segye.com/content/html/2021/03/10/20210310502814.html?OutUrl=naver,https://news.naver.com/main/read.nhn?mode=LSD&mid=sec&sid1=100&oid=022&aid=0003559696,연합뉴스 <b>홍준표</b> 무소속 의원은 10일 3기 신도시 관련 땅 투기 의혹 조사에 착수한 정부를 향해 “전 정권의 신도시까지 조사해서 물타기 해보려는 속 보이는 짓은 이제 그만하라”고 직격했다. 홍 의원은 이날 오전 자신의... ,"Wed, 10 Mar 2021 08:32:00 +0900"
"<b>홍준표</b> &quot;윤석열 밀어낸 文정권, 이재명 처리만 남았다&quot;",https://news.imaeil.com/Politics/2021030612215765255,https://news.naver.com/main/read.nhn?mode=LSD&mid=sec&sid1=100&oid=088&aid=0000691941,<b>홍준표</b> 무소속 의원이 6일 &quot;(정부여당은) 윤석열을 밀어냄으로써 야권 분열의 단초는 만들었고 이재명 처리만... 다음은 <b>홍준표</b> 의원 페이스북 글 전문. 검찰을 도구로 이용해 적폐수사로 행정부를 장악 하고 코드 사법부... ,"Sat, 06 Mar 2021 12:23:00 +0900"
"<b>홍준표</b> &quot;야, 특검·전수조사 반대, 켕기는 거 있나&quot;",http://www.newsbrite.net/news/articleView.html?idxno=146929,http://www.newsbrite.net/news/articleView.html?idxno=146929,"사진=<b>홍준표</b> 의원 <b>홍준표</b> 무소속 의원은 12일 &quot;특검도 반대하고, 전수 조사도 반대하고 도대체 야당이 뭐가 켕겨서 뒷걸음질  치나&quot;며 &quot;그래 가지고 야당 하겠나&quot;라고 국민의힘 지도부를 비판했다. 그는 이날 자신의... ","Sat, 13 Mar 2021 10:19:00 +0900"
<b>홍준표</b> &quot;이재명 '기본시리즈'는 10년前 '무상시리즈' 재탕&quot;,https://www.hankyung.com/politics/article/2021030884437,https://news.naver.com/main/read.nhn?mode=LSD&mid=sec&sid1=100&oid=015&aid=0004509843,있는 <b>홍준표</b> 무소속 의원(사진)은 &quot;이재명 경기도지사의 기본 시리즈는 10여 년 전 좌파 진영에서 들불처럼 퍼져 나갔던 무상시리즈의 이름만 바꾼 '재판'에 불과하다&quot;고 평가절하했다. <b>홍준표</b> 의원은 8일 페이스북에... ,"Mon, 08 Mar 2021 17:13:00 +0900"
이재명 '답장' 못 받은 <b>홍준표</b> &quot;연애도 무상으로 해&quot;,http://www.edaily.co.kr/news/newspath.asp?newsid=03624406628981352,https://news.naver.com/main/read.nhn?mode=LSD&mid=sec&sid1=100&oid=018&aid=0004870393,"<b>홍준표</b> 무소속 의원이 이번엔 이재명 경기도지사의 ‘기본 시리즈(기본주택·기본소득·기본대출)’를... 이재명 경기도지사(왼쪽), <b>홍준표</b> 무소속 의원 (사진=뉴스1)앞서 홍 의원은 이 지사를 겨냥해 연이어 노골적인... ","Mon, 08 Mar 2021 16:27:00 +0900"
"김부선 &quot;<b>홍준표</b>, 이재명과의 과거 사적영역 조롱말라…팩트는 '총각사칭'&quot;",https://news.imaeil.com/Politics/2021031014220597495,https://news.naver.com/main/read.nhn?mode=LSD&mid=sec&sid1=100&oid=088&aid=0000692690,배우 김부선이 이재명 경기도지사의 '여배우 스캔들'을 언급한 <b>홍준표</b> 무소속 의원을 향해 &quot;이재명과 저의 과거 관계는 분명히 사적영역&quot;이라며 &quot;조롱할 일이 아니다&quot;고 말했다. 김 씨는 10일 오전 페이스북을 통해 홍... ,"Wed, 10 Mar 2021 14:24:00 +0900"
"<b>홍준표</b>, 국민의힘에 쓴소리 “뭐가 켕겨서? 특검·전수조사 거부, 야당 맞나”",https://www.vop.co.kr/A00001554854.html,https://www.vop.co.kr/A00001554854.html,<b>홍준표</b> 무소속 의원이 한국토지주택공사(LH) 직원 투기로 촉발된 부동산 투기 관련 특별검사팀 구성과 국회의원 전수조사 방안을 거부하는 국민의힘을 향해 비판 목소리를 냈다.홍 의원은 12일 자신의 페이스북을 통해... ,"Fri, 12 Mar 2021 18:34:00 +0900"
